title,email,state,searchString,website,phoneUnformatted,address
"Dt. Özgür Önder, Diş Hekimi",iletisim@docplanner.com; user@domain.com.; homepage-pro-banner@2x.webp,Ankara,diş hekimleri,https://www.doktortakvimi.com/ozgur-onder-4/dis-hekimi/ankara?utm_source=google&utm_medium=gmb&utm_campaign=261969&utm_content=website,908503338344.0,"Aziziye, Ahenk Sk. 7/ B, 06490 Çankaya/Ankara, Türkiye"
"Dt. İrem Sena Divanlıoğlu, Diş Hekimi",iletisim@docplanner.com; user@domain.com.; homepage-pro-banner@2x.webp,Ankara,diş hekimleri,https://www.doktortakvimi.com/irem-sena-divanlioglu/dis-hekimi/ankara?utm_source=google&utm_medium=gmb&utm_campaign=243896&utm_content=website,,"Oran, Oran Mah, Kudüs cad Park Oran Ofis, Daire No: 54 Kat: 16, 06450 Çankaya/Ankara, Türkiye"
"Dt. Hazal Ceren Özçelik, Diş Hekimi",iletisim@docplanner.com; user@domain.com.; homepage-pro-banner@2x.webp,Ankara,diş hekimleri,https://www.doktortakvimi.com/hazal-ceren-ozcelik/dis-hekimi/ankara?utm_source=google&utm_medium=gmb&utm_campaign=258592&utm_content=website,908503338344.0,"Mustafa Kemal, 2150. Sk. No:5/A, 06530 Çankaya/Ankara, Türkiye"
Dr Diş Hekimi Altuğ Yeniay,bilgi@altugyeniay.com,Ankara,diş hekimleri,https://altugyeniay.com/,903124193974.0,"Meşrutiyet, Konur Sok. No:41 D:12, 06420 Çankaya/Ankara, Türkiye"
Çocuk Diş Hekimi Uzm. Dt. Kevser Danıştı (Uyutarak Diş Tedavisi) Ankara Çocuk Diş Hekimi,info@doktorsitesi.com; ik@doktorsitesi.com; kvkk@doktorsitesi.com,Ankara,diş hekimleri,https://www.doktorsitesi.com/kevser-danisti/pedodonti/ankara,905551870822.0,"Mustafa Kemal, 2118. Cd. Maidan İş ve Yaşam Merkezi No:4 C Blok Kat: 2, 06510 Çankaya/Ankara, Türkiye"
"Dr. Dt. Mert Ataol ( Diş Hekimi - Ağız, Diş ve Çene Cerrahisi)",info@doktorsitesi.com; ik@doktorsitesi.com; kvkk@doktorsitesi.com,Ankara,diş hekimleri,https://www.doktorsitesi.com/dr-dt-mert-ataol/dis-hekimi/ankara,,"Mustafa Kemal, Şht. Öğretmen Şenay Aybüke Yalçın Cd. No:36/23, 06680 Çankaya/Ankara, Türkiye"
Uzm. Dr. Aynur HORUZTEPE - Gülüş Tasarımı - Diş Hekimi,a.horuztepe@gmail.com,Ankara,diş hekimleri,http://www.aynurhoruztepe.com/,903124662277.0,"Mustafa Kemal Mah. Dumlupınar Bul. No: 274 B-Blok Kat:15 Daire:167, 06530 Çankaya/Ankara, Türkiye"
Ankara İmplant,dt.esraalparslan@gmail.com,Ankara,diş hekimleri,http://www.esraalparslan.com/,905494821775.0,"Aydınlar, Mayıs Hastanesi Acil Çıkışı, Hürriyet Cd. No:186 B 29, 06460 Çankaya/Ankara, Türkiye"
Çocuk Diş Hekimi Dr. Dt. Nurgül Demir,,Ankara,diş hekimleri,http://www.nurguldemir.com/,905323707517.0,"Barbaros, İran Cd. No:6 D D:3, 06680 Çankaya/Ankara, Türkiye"
Diş Hekimi Dr.Funda Ersöz (Restoratif Diş Tedavisi Uzmanı),info@fundaersoz.com.tr; bilgi@fundaersoz.com.tr; email@email.com,Ankara,diş hekimleri,http://www.fundaersoz.com.tr/,903124667808.0,"Ayrancı, Hoşdere Cd. No:1 D:7, 06540 Çankaya/Ankara, Türkiye"
"Dr. Dt. Berna Turgut, Diş Hekimi",iletisim@docplanner.com; user@domain.com.; homepage-pro-banner@2x.webp,Ankara,diş hekimleri,https://www.doktortakvimi.com/berna-turgut-2/dis-hekimi-protetik-dis-tedavisi/ankara?utm_source=google&utm_medium=gmb&utm_campaign=258125&utm_content=website,,"Balgat, Balgat Mahallesi Mevlana Bulvarı, 1422. Sk. No:4, 06520 Çankaya/Ankara, Türkiye"
Dr. Dt. Şule Yıldırım Çocuk Diş Hekimi - Batıkent Diş Hekimi,info@batiklinik.com.tr,Ankara,diş hekimleri,http://www.cocukdishekimim.com/,905546669461.0,"Ergazi Mah. Batı Bulvarı Nevadium No:109/B, 06370 Yenimahalle/Ankara, Türkiye"
"Dr. Dt. Ali Ursavaş, Diş Hekimi",iletisim@docplanner.com; user@domain.com.; homepage-pro-banner@2x.webp,Ankara,diş hekimleri,https://www.doktortakvimi.com/ali-ursavas/dis-hekimi/ankara?utm_source=google&utm_medium=gmb&utm_campaign=162470&utm_content=website,,"Mustafa Kemal, 2143. Sk. No:14/a, 06530 Çankaya/Ankara, Türkiye"
"Dt. Reyhan Durmuş, Diş Hekimi",iletisim@docplanner.com; user@domain.com.; homepage-pro-banner@2x.webp,Ankara,diş hekimleri,https://www.doktortakvimi.com/reyhan-durmus/dis-hekimi/ankara?utm_source=google&utm_medium=gmb&utm_campaign=243542&utm_content=website,908503338344.0,"Şehit Osman Avcı, 1419. Cd. No:10 D:102, 06820 Etimesgut/Ankara, Türkiye"
"Uzm. Dr. Serkan Dadakoğlu, Ağız diş ve çene cerrahisi, Diş hekimi",iletisim@docplanner.com; homepage-pro-banner@2x.webp,Ankara,diş hekimleri,https://www.doktortakvimi.com/serkan-dadakoglu/agiz-dis-ve-cene-cerrahisi/ankara?utm_source=google&utm_medium=gmb&utm_campaign=133753&utm_content=url_appointment,908503338344.0,"Koru, Ahmet Taner Kışlalı Cd. No:4 D:4, 06810 Çankaya/Ankara, Türkiye"
"Dt. Mehmet Atik, Diş Hekimi",iletisim@docplanner.com; user@domain.com.; homepage-pro-banner@2x.webp,Ankara,diş hekimleri,https://www.doktortakvimi.com/mehmet-atik-2/dis-hekimi/ankara?utm_source=google&utm_medium=gmb&utm_campaign=268595&utm_content=website,,"Bağlıca, Bağlıca Blv. No:60/F, 06790 Etimesgut/Ankara, Türkiye"
Conceptdent Agiz Ve Dis Sagligi Poliklinigi,info@conceptdent.com.tr,Ankara,diş hekimleri,http://conceptdent.com.tr/,903122403240.0,"Ahmet Taner Kışlalı Mah. 2715. Sok, Konsept Çayyolu Villaları No:2-7/b Çayyolu, 06810, Türkiye"
Enda Dental Ağız ve Diş Sağlığı Kliniği Beytepe,info@endadental.com,Ankara,diş hekimleri,http://www.endadental.com/,905305153020.0,"Beytepe, Ametist blokları, Kanuni Sultan Süleyman Blv 5/F, 06820 Çankaya/Ankara, Türkiye"
Dentists Pelin Aktay Esen,,Ankara,diş hekimleri,http://www.dishekimipelinaktayesen.com/,903124812120.0,"Aydınlar, Hürriyet Cd. No:186 D:B, 06450 Çankaya/Ankara, Türkiye"
Dr. Dt. Burçin Öncül - Ankara Gülüş Tasarımı | Zirkonyum | İmplant | Dijital Diş Hekimliği,burcinoncul@yahoo.com,Ankara,diş hekimleri,http://www.burcinoncul.com.tr/,903122364702.0,"Prof. Dr. Ahmet Taner Kışlalı Mahallesi Alacaatlı Caddesi Anchor iş merkezi, B blok kat:2 No:5 06810 Çayyolu Çankaya ANKARA,, 06810 Çankaya/Ankara, Türkiye"
DentAdal's Ağız ve Diş Sağlığı Polikliniği - Çayyolu,cayyoludentada@gmail.com; info@dentadapolatli.com,Ankara,diş hekimleri,http://www.dentadals.com/,905077455030.0,"Prof. Dr. Ahmet Taner Kışlalı, Alacaatlı Cd. No:14 D:18, 06810 Çankaya/Ankara, Türkiye"
Özel Dent Trio Ağız ve Diş Sağlığı Polikliniği,,Ankara,diş hekimleri,http://www.zerrinonem.com/,903125024222.0,"Çayyolu, Prof. Dr. Ahmet Taner Kışlalı Mahallesi, 2864. Cd. 34/3, 06810 Çankaya/Ankara, Türkiye"
Dent Oran Ağız ve Diş Sağlığı Polikliniği - Oral & Dental Health Center,info@dentoran.com,Ankara,diş hekimleri,https://dentoran.com/,903124900300.0,"Oran, Türk-japon Vakfı, Ferit Recai Ertuğrul Cd. No:2 D:h, 06450 Çankaya/Ankara, Türkiye"
Diş Hekimi Burak Bayındır,,Ankara,diş hekimleri,http://burakbayindir.com/,905309241362.0,"Işınlar, İvedik Cd. No:66, 06170 Yenimahalle/Ankara, Türkiye"
"Uzm. Dt. Merve Salmanlı, Diş Hekimi",iletisim@docplanner.com; user@domain.com.; homepage-pro-banner@2x.webp,Ankara,diş hekimleri,https://www.doktortakvimi.com/merve-salmanli/dis-hekimi-cocuk-dis-hekimligi-pedodonti/ankara?utm_source=google&utm_medium=gmb&utm_campaign=250365&utm_content=website,908503338344.0,"Yeni Bağlıca, Bağlıca Blv. No:60 D:F, 06793 Etimesgut/Ankara, Türkiye"
"Dt. Emre Bal, Diş Hekimi",iletisim@docplanner.com; user@domain.com.; homepage-pro-banner@2x.webp,Ankara,diş hekimleri,https://www.doktortakvimi.com/emre-bal-3/dis-hekimi/ankara?utm_source=google&utm_medium=gmb&utm_campaign=256756&utm_content=website,905327278876.0,"Mustafa Kemal, Bilkent Metro Durağı, Eskişehir Yolu MAİDAN İş Merkezi A Blok, Kat:11 No:121, 06520 Çankaya/Ankara, Türkiye"
"Dt. Ceren Bener Aksaray, Diş Hekimi",iletisim@docplanner.com; homepage-pro-banner@2x.webp,Ankara,diş hekimleri,https://www.doktortakvimi.com/ceren-bener-aksaray/dis-hekimi/ankara?utm_source=google&utm_medium=gmb&utm_campaign=252567&utm_content=website,903122875670.0,"Kızılırmak, 1441. Cd. Mercan Apt No:5/13, 06510 Çankaya/Ankara, Türkiye"
"Uzman Dr. Dt. Ayşegül Ünalmış, Çocuk Diş Hekimliği (Pedodonti)",iletisim@docplanner.com; homepage-pro-banner@2x.webp,Ankara,diş hekimleri,https://www.doktortakvimi.com/aysegul-unalmis/cocuk-dis-hekimligi-pedodonti-dis-hekimi/ankara?utm_source=google&utm_medium=gmb&utm_campaign=233746&utm_content=website,903124804242.0,"Şeker, Rainbow Residence, 1417. Cd. No:7/B, 06820 Etimesgut/Ankara, Türkiye"
"BatıKlinik Ağız ve Diş Sağlığı Polikliniği - Protez Uzmanı, Batıkent İmplant Tedavisi, Batıkent Diş Hekimi",info@batiklinik.com.tr,Ankara,diş hekimleri,http://www.batiklinik.com.tr/,903125570405.0,"Ergazi Mahallesi Batı Bulvarı 109/B/F Nevadium, 06370 Yenimahalle/Ankara, Türkiye"
"Dt. Sedanur Demir Aksoy, Diş Hekimi",homepage-pro-banner@2x.webp,Ankara,diş hekimleri,https://www.doktortakvimi.com/sedanur-demir-aksoy/dis-hekimi/ankara?utm_source=google&utm_medium=gmb&utm_campaign=149728&utm_content=website,908503338344.0,"Yenibatı Mah. Necip Fazıl Cad. Hit Town Sitesi No:13F/A-23, 06370 Ankara, Türkiye"
"Dt. Tuğba İset, Diş Hekimi",homepage-pro-banner@2x.webp,Ankara,diş hekimleri,https://www.doktortakvimi.com/tugba-iset/dis-hekimi/ankara?utm_source=google&utm_medium=gmb&utm_campaign=271755&utm_content=website,,"Akçay Mah, Cengiz Topel Cad. Kızılcahamam No: 21A, 06890 Altındağ/Ankara, Türkiye"
Çocuk Diş Hekimi Prof. Dr. Zafer Çehreli,bilgi@zafercehreli.com.tr,Ankara,diş hekimleri,https://www.zafercehreli.com.tr/,905323707517.0,"Barbaros, İran Cd. No:6 D D:3, 06680 Çankaya/Ankara, Türkiye"
Uzman Diş Hekimi Ela Öner Aytar (Pedodonti - Çocuk Diş Hekimliği),info@doktorsitesi.com; ik@doktorsitesi.com; kvkk@doktorsitesi.com,Ankara,diş hekimleri,https://www.doktorsitesi.com/uzm-dt-ela-oner-aytar/dis-hekimi/ankara,,"Bahçelievler, Aşkabat Caddesi (7, Cadde No:17/6, 06490 Çankaya/Ankara, Türkiye"
Diş Hekimi Adnan Uzluer,auzluer@hotmail.com; auzluer@gmail.com,Ankara,diş hekimleri,http://www.adnanuzluer.com/,905324755859.0,"Kocatepe, Bayındır-2 Sk. 52/B, 06420 Çankaya/Ankara, Türkiye"
Doç. Dr. Fatih Tulumbacı Çocuk Diş Hekimi-Sedasyon (Uyutarak) Diş Tedavisi,,Ankara,diş hekimleri,http://www.fatihtulumbaci.com/,905013453083.0,"Çayyolu Mah. 2683 Cadde No:3 So Çayyolu D Blok Kat-2 ÇEDA Çocuk Sağlığı Merkezi, 06810 Çankaya/Ankara, Türkiye"
"Dr.Dt. Betül Büşra Ursavaş, Çocuk Diş Hekimi",iletisim@docplanner.com; homepage-pro-banner@2x.webp,Ankara,diş hekimleri,https://www.doktortakvimi.com/betul-busra-ursavas/dis-hekimi/ankara?utm_source=google&utm_medium=gmb&utm_campaign=233042&utm_content=website,908503338344.0,"Mustafa Kemal, 2143. Sk. No:14A, 06510 Çankaya/Ankara, Türkiye"
"Uzm. Dt. Tanyel Özkan Çendek, Diş Hekimi",iletisim@docplanner.com; user@domain.com.; homepage-pro-banner@2x.webp,Ankara,diş hekimleri,https://www.doktortakvimi.com/tanyel-ozkan-cendek/dis-hekimi-cocuk-dis-hekimligi-pedodonti/ankara?utm_source=google&utm_medium=gmb&utm_campaign=256600&utm_content=website,,"Yukarı Bahçelievler, Aşkabat Cd., 06490 Çankaya/Ankara, Türkiye"
"Dr. Özgür Yıldırım Torun, Diş Hekimi",iletisim@docplanner.com; user@domain.com.; homepage-pro-banner@2x.webp,Ankara,diş hekimleri,https://www.doktortakvimi.com/ozgur-yildirim-torun/dis-hekimi-tibbi-mikrobiyoloji/ankara?utm_source=google&utm_medium=gmb&utm_campaign=135664&utm_content=website,,"Çankaya, Cinnah Cd. No:33/7, 06680 Çankaya/Ankara, Türkiye"
Diş Hekimi - Ortodonti Uzmanı - Dr. Handan Tuğçe Oğuz,,Ankara,diş hekimleri,http://tugceoguzortodonti.com/,903124680090.0,"Kavaklıdere, Tunus Cd No:74 D:1, 06680 Çankaya/Ankara, Türkiye"
Çocuk Diş Hekimi Prof. Dr. Aylin Akbay Oba Pedodontist Ankara,info@aylinakbayoba.com,Ankara,diş hekimleri,https://aylinakbayoba.com/,905302356127.0,"Maidan İş Merkezi Mustafa Kemal Mahallesi 2118.Cadde A Blok Kat:11 Daire:127, 06530 Çankaya/Ankara, Türkiye"
"Dr. Dt. S. Duygu Sipahi, Diş Hekimi",iletisim@docplanner.com; user@domain.com.; homepage-pro-banner@2x.webp,Ankara,diş hekimleri,https://www.doktortakvimi.com/s-duygu-sipahi/dis-hekimi-ortodonti/ankara?utm_source=google&utm_medium=gmb&utm_campaign=145320&utm_content=website,,"Kavaklıdere, Tunalı Hilmi Cd. No:92/15 K:4, 06680 Çankaya/Ankara, Türkiye"
Diş Hekimi Emine Şen,,Ankara,diş hekimleri,https://enyakinnerde.com/dishekimi/125410-dis-hekimi-emine-sen,903123162744.0,"Aydınlıkevler Mh, Şht. Bülent Ay Sk. Pk:06130, 06130 Altındağ/Ankara, Türkiye"
"Dr. Dt. Emre ÇAKIR - Ankara Ortodonti Uzmanı - Batıkent Diş Hekimi - Estetik Ortodonti - İmplant, Zirkonyum, Diş Beyazlatma",info@estetikveortodonti.com; nfo@estetikveortodonti.com,Ankara,diş hekimleri,http://www.estetikveortodonti.com/,905444961496.0,"Kentkoop Mahallesi, 1, Başkent Blv No:255/41 Batıkent Meydan AVM içi, 06370 Yenimahalle/Ankara, Türkiye"
Dt. Emre Güneş - Diş Hekimi Çukurambar,,Ankara,diş hekimleri,http://www.emregunes.com.tr/,905414322444.0,"Kızılırmak Mah. Ufuk Üniversitesi Cad. Paragon İş Merkezi Kat: 15 Daire: 78, 06510 Çankaya, Türkiye"
Çocuk Diş Hekimi Prof. Dr. Sevi Burçak Çehreli,bilgi@burcakcehreli.com,Ankara,diş hekimleri,https://www.burcakcehreli.com/,905302018868.0,"Çankaya, Çankaya Cd. No:4/6, 06680 Çankaya/Ankara, Türkiye"
"Dr. Dt. Nezate Dadakoğlu, Çocuk Diş Hekimliği (Pedodonti)",iletisim@docplanner.com; homepage-pro-banner@2x.webp,Ankara,diş hekimleri,https://www.doktortakvimi.com/nezate-dadakoglu/cocuk-dis-hekimligi/ankara?utm_source=google&utm_medium=gmb&utm_campaign=133751&utm_content=website,908503338344.0,"Çayyolu, Koru Mahallesi, Ahmet Taner Kışlalı Cd. No: 4/4, 06810 Ankara, Türkiye"
Uzman Diş Hekimi Burcu Toksoy,info@website.com; info@burcutoksoy.com; info@example.com,Ankara,diş hekimleri,https://burcutoksoy.com/,905334881908.0,"Mustafa Kemal, 2079. Sk. Via Green Plaza A blok No:19, 06510 Çankaya/Ankara, Türkiye"
Dr. Dt. Çağrı Özçelebi,,Ankara,diş hekimleri,https://hititdental.com/,905326901931.0,"Kızılay, Dost Kitabevi Üstü, Karanfil Sk. No:11/17, 06420 Çankaya/Ankara, Türkiye"
Klinik Çayyolu,bilgi@klinikcayyolu.com,Ankara,diş hekimleri,http://www.klinikcayyolu.com/,905304042993.0,"Prof. Dr. Ahmet Taner Kışlalı Mah 2715. Sokak, Konsept Çayyolu İş Merkezi D:2/3A, 06810 Çankaya/Ankara, Türkiye"
Sümerdent Ağız ve Diş Sağlığı Polikliniği,sumerdentadsp@gmail.com,Ankara,diş hekimleri,http://www.sumerdent.com/,903124812244.0,"Osman Temiz, Dikmen Cd No:307, 06450 Çankaya/Ankara, Türkiye"
Diş Hekimi Nihat Yalçın,,Ankara,diş hekimleri,http://www.dentli.com/,903124387771.0,"Hilal, Hollanda Cd. 9/5, 06550 Çankaya/Ankara, Türkiye"
Uzman Diş Hekimi Recep Sezer Yıldırım - Zirkonyum Diş Tedavisi - İmplant Diş Tedavisi - Protez Uzmanı,,Ankara,diş hekimleri,http://www.sezeryildirim.com.tr/,905551427584.0,"Ergazi, Batı Blv No:109 D:E, 06370 Yenimahalle/Ankara, Türkiye"
Ortodonti Uzmanı Diş Hekimi Kaya Gökçe Dinçyürek,destek@ceomedical.com,Ankara,diş hekimleri,http://www.kayagokcedincyurek.com/,903122353136.0,"Ümit Mah., 2494. Sok. Çamlıca Bulvar Sitesi A blok, D:5 Ümitköy, 06810 Çankaya/Ankara, Türkiye"
Diş Hekimi Demet Çıkrıkcı,info@dishekimicemalcakir.com; info@cemdental.com,Ankara,diş hekimleri,https://cemdental.com/,903124822202.0,"Öveçler, Kabil Cd. No: 7, 06520 Çankaya/Ankara, Türkiye"
"Uzm. Dt. Özün Karaahmetoğlu, Diş Hekimi",iletisim@docplanner.com; user@domain.com.; homepage-pro-banner@2x.webp,Ankara,diş hekimleri,https://www.doktortakvimi.com/ozun-karaahmetoglu/dis-hekimi-agiz-dis-ve-cene-cerrahisi/ankara?utm_source=google&utm_medium=gmb&utm_campaign=142758&utm_content=website,908503338344.0,"Kızılay, Ali Taha Apt, Meşrutiyet Mahallesi, Selanik Cd No:52/15-16, 06420 Çankaya/Ankara, Türkiye"
Diş Hekimi Sema Çetin,605a7baede844d278b89dc95ae0a9123@sentry-next.wixpress.com; info@santraadsp.com; 8eb368c655b84e029ed79ad7a5c1718e@sentry.wixpress.com; 2062d0a4929b45348643784b5cb39c36@sentry.wixpress.com,Ankara,diş hekimleri,http://www.santraadsp.com/,905437268720.0,"Çayyolu mahallesi 2675. Elit Blok Sokak no:2BA, 06810 Çankaya/Ankara, Türkiye"
Ankara İmplant - Diş Hekimi Cemal Seçkin,info@ankaraimplant.com.tr,Ankara,diş hekimleri,https://www.ankaraimplant.com.tr/,903122123939.0,"Kızılay, Kocatepe Mahallesi, Meşrutiyet Cd. No:32/8 Kat:4, 06420 Çankaya, Türkiye"
Uzm. Dr. Dt. Tuğba Çınar Türk Diş Kliniği /Sedasyonla Diş Tedavisi/Ankara Çocuk Diş Doktoru,cocuklarindisklinigi@gmail.com; i@gmail.com,Ankara,diş hekimleri,http://www.cocukdisdoktorunuz.com/,905468207535.0,"Konutkent mah 2945 cadde Hayal sitesi 25/2 çayyolu, 06810 Çankaya/Ankara, Türkiye"
"Uzman Diş Hekimi Büşra Şenöz, Protetik Diş Tedavisi",iletisim@docplanner.com; homepage-pro-banner@2x.webp,Ankara,diş hekimleri,https://www.doktortakvimi.com/busra-senoz/protetik-dis-tedavisi-dis-hekimi/ankara,903124667599.0,"Mustafa Kemal, 2118. Cd. Maidan İş Merkezi B Blok Ofis No:6, 06510 Çankaya/Ankara, Türkiye"
ModaDent Ağız ve Diş Sağlığı Polikliniği,,Ankara,diş hekimleri,https://www.instagram.com/modadent,905550269001.0,"Etlik, Adnan Yüksel Caddesi No:21/B, 06010 Keçiören/Ankara, Türkiye"
Diş Hekimi Mine Zihni Ulu,,Ankara,diş hekimleri,https://www.tikla.com.tr/mine-zihni-ulu-muayenehanesi.html,903124830666.0,"Harbiye, Sokullu Mehmet Paşa Cd. No:79 D:c, 06450 Çankaya/Ankara, Türkiye"
Hasan Koyuncu Diş Hekimi,info@hasankoyuncu.com,Ankara,diş hekimleri,http://www.hasankoyuncu.com/iletisim/,903124254787.0,"Kızılay, Atatürk Blv No:115, 06420 Çankaya/Ankara, Türkiye"
Diş Hekimi Dr. Sema Altunsoy,info@semaaltunsoy.com,Ankara,diş hekimleri,http://www.semaaltunsoy.com/,903124284243.0,"Kavaklıdere, Tunus Cd 71/6, 06000 Çankaya/Ankara, Türkiye"
Diş Hekimi İsmihan Pişkin,bilgi@dentalankara.net,Ankara,diş hekimleri,http://www.dentalankara.net/,903122360416.0,"Kavaklıdere, Olgunlar Cd. No:2 D:16, 06680 Çankaya/Ankara, Türkiye"
DentisLife Ağız ve Diş Sağlığı Polikliniği,info@dentislife.com,Ankara,diş hekimleri,http://dentislife.com/,903124477060.0,"Büyükesat, Uğur Mumcu Cd. No:59 D:9, 06600 Çankaya/Ankara, Türkiye"
Batıkent Diş Hastanesi,info@ilkumuttip.com,Ankara,diş hekimleri,https://www.ilkumuttip.com/,905062651006.0,"Ergazi, Batıkent Blv., 06560 Yenimahalle/Ankara, Türkiye"
Hospitadent Ankara Diş Hastanesi,,Ankara,diş hekimleri,http://www.hospitadent.com/,903124684144.0,"Prof. Dr. Ahmet Taner Kışlalı Mahallesi, Anchor İş Merkezi, No:3 D Blok, 06810 Çankaya/Ankara, Türkiye"
"BC Dental Clinic - Dr. BC | Beytepe Estetik Diş Kliniği, İnvisalign ve Ortognatik Cerrahi",info@bcdentalclinic.com,Ankara,diş hekimleri,https://drbcdentalclinic.com/,903125437043.0,"Beytepe, Kanuni Sultan Süleyman Bulvarı, 5387.Cd. NO:15 A / 4, 06800 Çankaya/Ankara, Türkiye"
Dt. Tuba Selimoğlu Beytepe Diş Kliniği,,Ankara,diş hekimleri,https://www.lentodent.com/,905057878081.0,"Beytepe, Beytepe Mahallesi 5388.sokak No:1/C-5 Çankaya/Ankara 1923, 06800 Çankaya/Ankara, Türkiye"
Uzm.Dr.Derin Demircioğlu Smile Studio - Ortodontist - Şeffaf Plak Ankara - Tel Tedavisi- İnvisalign - İmplant Tedavisi-,,Ankara,diş hekimleri,https://drderindemircioglu.com/,905323990230.0,"Alacaatlı, 3346. Cd No:60 D:17, 06810 Çankaya/Ankara, Türkiye"
Özel Sevgi Savaş Akbaş ADSP,,Ankara,diş hekimleri,https://sevgisavas.com/,903124301202.0,"Kızılcaşar, 1214. Sk. No:11B, 06770 İncek/Ankara, Türkiye"
Astrodent Ağız ve Diş Sağlığı Polikliniği,.@hs02.kep.tr; ozeldentpro@gmail.com; ..........@hs02.kep.tr,Ankara,diş hekimleri,https://astrodent.com.tr/,905545843324.0,"Alacaatlı, Beyler Cd. no:36 D:17, 06810 Çankaya/Ankara, Türkiye"
DİŞ HEKİMİ SAMET KADİR,,Ankara,diş hekimleri,https://www.instagram.com/dt.sametkadir_dis_klinigi,903124190600.0,"Kızılay, Selanik Cd No:26 D:12, 06420 Çankaya/Ankara, Türkiye"
Karaer Ağız ve Diş Sağlığı Merkezi,78f7996315bc402f9dcb8a2f974b82d1@sentry.wixpress.com; 605a7baede844d278b89dc95ae0a9123@sentry-next.wixpress.com; ornek@sitem.com; dd0a55ccb8124b9c9d938e3acf41f8aa@sentry.wixpress.com; 2062d0a4929b45348643784b5cb39c36@sentry.wixpress.com; c183baa23371454f99f417f6616b724d@sentry.wixpress.com; 8c4075d5481d476e945486754f783364@sentry.io; 460ff4620fa44cba8df530afde949785@sentry.wixpress.com; 5d1795a2db124a268f1e1bd88f503500@sentry.wixpress.com; example@mysite.com.; 271e9fa3230b4eec94b02bf95780f5f2@sentry.wixpress.com; 8eb368c655b84e029ed79ad7a5c1718e@sentry.wixpress.com; 18d2f96d279149989b95faf0a4b41882@sentry-next.wixpress.com; info@karaerdent.com,Ankara,diş hekimleri,https://www.karaerdent.com/,905537721234.0,"Beytepe, 1728. Cad 6-18, 06800 Çankaya/Ankara, Türkiye"
DENTAVEND Ağız ve Diş Sağlığı Polikliniği,,Ankara,diş hekimleri,https://www.dentavend.com/,905524467774.0,"Keklik Pınarı, Dikmen Cd No 435 D:10, 06450 Çankaya/Ankara, Türkiye"
Diş Hekimi Handan Bulut,,Ankara,diş hekimleri,http://handankoprulubulut.com/,903124900915.0,"Yukarı Dikmen Mahallesi Turan Güneş Bulv. Ürdün Cad, Ürdün Cd. No:6 D:2B, 06450 Çankaya/Ankara, Türkiye"
StyleDent Özel Yaşamkent Diş Polikliniği,info@yasamkentdisklinigi.com.tr,Ankara,diş hekimleri,https://www.yasamkentdisklinigi.com.tr/,903122176454.0,"Yaşamkent, 3158. Cd. no:71, 06810 Çankaya/Ankara, Türkiye"
Diş Hekimi Mustafa Güven,info@doktorsitesi.com; ik@doktorsitesi.com; kvkk@doktorsitesi.com,Ankara,diş hekimleri,https://www.doktorsitesi.com/mustafa-guven/dis-hekimi/ankara,908504742232.0,"Osman Temiz, Dikmen Cd No:307/A, 06450 Çankaya/Ankara, Türkiye"
Beytepe Ortodonti,info@drdogualpatcicek.com,Ankara,diş hekimleri,https://beytepeortodonti.com/,903125778383.0,"Beytepe, 5387. Cad Mira, Kanuni Sultan Süleyman Blv Ofis 15/A Kat:14 No:55, 06800 Çankaya/Ankara, Türkiye"
Beytepe Lento Dent Ağız ve Diş Sağlığı Polikliniği,,Ankara,diş hekimleri,https://www.lentodent.com/,905057878081.0,"Beytepe, 5388. Sokak No: 1 C-5, 06800 Çankaya/Ankara, Türkiye"
Gürses Dental Beytepe Ağız Diş Sağlığı Hastanesi,info@gursesdental.com.tr,Ankara,diş hekimleri,http://www.gursesdental.com.tr/,905079440043.0,"Beytepe, Kanuni Sultan Süleyman Blv No:18 B/3, 06800 Çankaya/Ankara, Türkiye"
"Moondent Diş Polikliniği : İmplant, Zirkonyum, Lamine",info@moondent.com,Ankara,diş hekimleri,http://moondent.com/,903122357779.0,"Yaşamkent Mah 3296. Cad. Gözüm Park Yaşam Merkezi 2/D, 06810 Çankaya/Ankara, Türkiye"
MISIROĞLU EXCLUSİVE AĞIZ VE DİŞ SAĞLIĞI POLİKLİNİĞİ,,Ankara,diş hekimleri,https://misirogluexclusive.com/,905322849587.0,"Beytepe, 5339. sk no:9, 06800 Çankaya/Ankara, Türkiye"
"Çocuk Dişçim Çayyolu Ankara - Dr. Diş Hekimi Sezgi Şenol | Uyutarak (Sedasyonla) Diş Tedavisi, Çocuk Dişçisi",info@cocukdiscim.com; cocukdiscim@gmail.com,Ankara,diş hekimleri,https://cocukdiscim.com/,905448105565.0,"Prof. Dr. Ahmet Taner Kışlalı, 2812. Cd. NO:3, 06810 Çankaya/Ankara, Türkiye"
Art&Smile Dental Clinic,artnsmileclinic@gmail.com; artnsmile@hs01.kep.tr,Ankara,diş hekimleri,http://www.artnsmileclinic.com/,903122172022.0,"Yaşamkent, 3158. Cd. No:32C D:6, 06810 Çankaya/Ankara, Türkiye"
Diş Hekimi Dr. Cüneyt Bosna,drcuneytbosna@gmail.com,Ankara,diş hekimleri,https://www.cuneytbosna.com/,903124252126.0,"Kocatepe, Selanik Cd 39/6, 06420 Çankaya/Ankara, Türkiye"
Diş Hekimi Rana Kuzu,ranakitap@gmail.com,Ankara,diş hekimleri,http://www.ranakuzu.com/,903124956633.0,"Birlik, Podgoritsa Cd No:22/B, 06610 Çankaya/Ankara, Türkiye"
Diş Hekimi Neşe Şahiner,,Ankara,diş hekimleri,https://iyifirma.com/dr-nese-sahiner/,903124193449.0,"Meşrutiyet, Selanik Cd No:36 D:12, 06420 Çankaya/Ankara, Türkiye"
Diş Doktoru Hıdır Öztürk,info@doktorsitesi.com; ik@doktorsitesi.com; kvkk@doktorsitesi.com,Ankara,diş hekimleri,https://www.doktorsitesi.com/dr-dt-hidir-ozturk/dis-hekimi/ankara,908508113161.0,"Kocatepe, Bayındır-2 Sk. 40/6, 06420 Çankaya/Ankara, Türkiye"
"Dr.Dt.Enver Akın Özkan Ankara Ortodonti Uzmanı, Ankara Diş Teli, Ankara Invisalign Şeffaf Plak Tedavisi , Ankara Orthodontist",bilgi@enverakinozkan.com.tr,Ankara,diş hekimleri,http://www.enverakinozkan.com.tr/,903122360416.0,"Kavaklıdere, Olgunlar Cd. No:2, 06680 Çankaya/Ankara, Türkiye"
"Dt. Zeynep Hazal Yıldırım, Diş Hekimi",iletisim@docplanner.com; user@domain.com.; homepage-pro-banner@2x.webp,Ankara,diş hekimleri,https://www.doktortakvimi.com/zeynep-hazal-yildirim/dis-hekimi/ankara?utm_source=google&utm_medium=gmb&utm_campaign=268227&utm_content=website,908503338344.0,"Peyami Sefa, 344. Cd. No:52 D:C, 06630 Mamak/Ankara, Türkiye"
"Dt. Ayşe İpek Özden, Diş Hekimi",iletisim@docplanner.com; homepage-pro-banner@2x.webp,Ankara,diş hekimleri,https://www.doktortakvimi.com/ayse-ipek-ozden/dis-hekimi/ankara?utm_source=google&utm_medium=gmb&utm_campaign=274566&utm_content=website,,"Güneşevler, Şht. Ömer Halisdemir Blv No:172/A, 06160 Altındağ/Ankara, Türkiye"
Dr. Dt. Burcu Kocatüfek Özyılmaz I DentKozmos,,Ankara,diş hekimleri,https://www.burcukocatufek.com/,905388837087.0,"Çayyolu, Beytepe Mah. Kanuni Sultan Süleyman Bulvarı Allora Beytepe 63, C/10, 06800 Çankaya/Ankara, Türkiye"
Özel Beytepe Ağız ve Diş Sağlığı Polikliniği,605a7baede844d278b89dc95ae0a9123@sentry-next.wixpress.com; dd0a55ccb8124b9c9d938e3acf41f8aa@sentry.wixpress.com; info@hilldentclinics.com; c183baa23371454f99f417f6616b724d@sentry.wixpress.com; 8c4075d5481d476e945486754f783364@sentry.io; 1eeb89147c984dc6bc3ffafd9e6cd089@sentry.wixpress.com; email@email.com; 8eb368c655b84e029ed79ad7a5c1718e@sentry.wixpress.com; contact@bmcw.com.tr,Ankara,diş hekimleri,https://hilldentclinics.com/?utm_source=google&utm_medium=wix_google_business_profile&utm_campaign=3159725567954573702,905516927099.0,"Beytepe, Plevne Caddesi 10C/A D:1, 06800 Çankaya/Ankara, Türkiye"
