title,email,state,searchString,website,phoneUnformatted,address
Diş Hekimi Salih HAZIR,605a7baede844d278b89dc95ae0a9123@sentry-next.wixpress.com,Mersin,diş hekimleri,http://dtsalihhazir33.wixsite.com/salihhazir,905314734120.0,"İnönü, Gazi Mustafa Kemal Blv. No:403, 33130 Yenişehir/Mersin, Türkiye"
Dr.Dt. Tuba Şentut Çocuk Diş Hekimi,,Mersin,diş hekimleri,http://www.instagram.com/cocukdishekimi_tuba.sentut,903243267776.0,"Gazi, Gazi mah. Gmk Bulvarı Eren Ap, Gazi Mustafa Kemal Blv. No:269 D:355/3, 33130 Yenişehir/Mersin, Türkiye"
Diş Hekimi Ezgi Ünal,,Mersin,diş hekimleri,https://www.doktorsitesi.com/dt-ezgi-unal/dis-hekimi/mersin,908504740906.0,"Güvenevler, 1901. Sk. No: 25/1, 33140 Yenişehir/Mersin, Türkiye"
"Uzm.Dr.Ruhengiz Efendiyeva,PhD",,Mersin,diş hekimleri,https://mersinidealdent.com/,905427744657.0,"Gazi, Gazi Mustafa Kemal Blv. No:309, 33130 Yenişehir/Mersin, Türkiye"
Dr. Aysegul Akyilmaz,iletisim@docplanner.com; homepage-pro-banner@2x.webp,Mersin,diş hekimleri,https://www.doktortakvimi.com/aysegul-akyilmaz/dis-hekimligi/mersin,903243287788.0,"Gazi, 1306. Sk. No:7 D:1, 33130 Yenişehir/Mersin, Türkiye"
"Dt. Aslı Özel Sabuncuoğlu, Diş Hekimi",iletisim@docplanner.com; homepage-pro-banner@2x.webp,Mersin,diş hekimleri,https://www.doktortakvimi.com/asli-ozel-sabuncuoglu/dis-hekimi/mersin?utm_source=google&utm_medium=gmb&utm_campaign=264864&utm_content=website,,"Güvenevler, Hüseyin Okan Merzeci Blv No:528A, 33140 Yenişehir/Mersin, Türkiye"
"Dt. Safa Turan Sabuncuoğlu, Diş Hekimi",iletisim@docplanner.com; homepage-pro-banner@2x.webp,Mersin,diş hekimleri,https://www.doktortakvimi.com/safa-turan-sabuncuoglu/dis-hekimi/mersin?utm_source=google&utm_medium=gmb&utm_campaign=264863&utm_content=website,,"Güvenevler, Hüseyin Okan Merzeci Blv No:528/A, 33140 Yenişehir/Mersin, Türkiye"
Diş hekimi Fatih Sakar,bilgi@fatihsakar.com,Mersin,diş hekimleri,http://www.fatihsakar.com/,905331392534.0,"Kültür Mahallesi Atatürk Caddesi Miskavi Apt. No:56 Kat:5/10, 33010 Akdeniz/Mersin, Türkiye"
Diş Hekimi Berk yılmaz,,Mersin,diş hekimleri,http://www.dtberkyilmaz.com/,905349777050.0,"https://maps.app.goo.gl/tYuwq7nk72KaERbw9?g_st=ac, 33070 Akdeniz/Mersin, Türkiye"
Diş Hekimi Seyran Kara,iletisim@docplanner.com; homepage-pro-banner@2x.webp,Mersin,diş hekimleri,https://www.doktortakvimi.com/z/CuDqVw,,"Kiremithane, 4413. Sk. Akkurt Apt No:5/4, 33010 Akdeniz/Mersin, Türkiye"
Diş Hekimi Sena Kurt,iletisim@docplanner.com; homepage-pro-banner@2x.webp,Mersin,diş hekimleri,https://www.doktortakvimi.com/sena-kurt/dis-hekimi/mersin?utm_source=google&utm_medium=gmb&utm_campaign=260515&utm_content=url_appointment,908503338344.0,"Bahçe, İstiklal Cd. No:94, 33000 Akdeniz/Mersin, Türkiye"
Dr. Taner Akca,,Mersin,diş hekimleri,http://www.mersinpedodonti.com/,903242384584.0,"Kültür Mahallesi 4302 Sok. Toroğlu Apt, B Blok D:6, 33100 İçel Merkez/Mersin, Türkiye"
Dr. Ekrem Duran,,Mersin,diş hekimleri,http://www.ekremduran.com/,903242380371.0,"Akdeniz, Çankaya Mahallesi, İstiklal Caddesi, 4738 Sokak Özberk Apt Kat:1 No:3, Nobel Oteli Karşısı, Mersin, Türkiye"
Özel MerDiş ağız ve diş sağlığı polikliniği,info@merdis.com.tr,Mersin,diş hekimleri,http://www.merdis.tr/,903242375300.0,"Turgutreis, 4112. Sk, 33010 Akdeniz/Mersin, Türkiye"
Özel DENT365 Ağız Ve Diş Sağlığı Polikliniği,,Mersin,diş hekimleri,https://www.dent365mersin.com/,905069110365.0,"İstiklal cad. Noyan apt. zemin kart 103E, 33120 Akdeniz/Mersin, Türkiye"
MERSİN OPAK DENT AĞIZ VE DİŞ SAĞLIĞI POLİKLİNİĞİ,,Mersin,diş hekimleri,https://www.instagram.com/opakdent_dis_poliklinigi?igsh=eXR5aGIwMHpoNmRq,905305421300.0,"Bahçe, İstiklal Cd. No:100 D:B, 33010 Akdeniz/Mersin, Türkiye"
Özel Çarşı İdealdent Ağız ve Diş Sağlığı Polikliniği,,Mersin,diş hekimleri,http://www.mersinidealdent.com/,,"Çankaya, İstiklal Cd. No: 84/A, 33070 Akdeniz/Mersin, Türkiye"
Oral and Dental Health Center,mersin.adsm@saglik.gov.tr; mersinsaglik@hs01.kep.tr; khgm.iletisim@saglik.gov.tr,Mersin,diş hekimleri,http://mersinadsh.saglik.gov.tr/,903242241565.0,"Çağdaşkent, Mimar Sinan Blv. No:75, 33230 Toroslar/Mersin, Türkiye"
Mersin ağız ve diş sağlığı hastanesi,mersinsaglik@hs01.kep.tr; mersin@saglik.gov.tr; mmtamerikan@mmtamerikan.com; mersin.ies@saglik.gov.tr,Mersin,diş hekimleri,"https://mersinism.saglik.gov.tr/TR,50524/mersin-agiz-ve-dis-sagligi-hastanesi.html",903242241565.0,"Çağdaşkent, Fatih Sultan Mehmet Blv. 22 A, 33230 Toroslar/Mersin, Türkiye"
"Dt. Ezgi Cesur, Diş Hekimi",homepage-pro-banner@2x.webp,Mersin,diş hekimleri,https://www.doktortakvimi.com/ezgi-cesur-2/dis-hekimi/mersin?utm_source=google&utm_medium=gmb&utm_campaign=268688&utm_content=website,908503338344.0,"Bahçelievler Mahallesi H. Okan Merzeci Bulvarı 1858 Sokak No:480, 33000 Yenişehir/Mersin, Türkiye"
Dr. Murat Cömert - Diş Hekimi Periodontoloji Uzmanı,,Mersin,diş hekimleri,http://drmuratcomert.com/,903243251050.0,"İsmet İnönü Blv. No:53 Merkon Sitesi B Blok, Kat 1, 33110 Yenişehir/Mersin, Türkiye"
"Dt. Hasret Börekçi Gündüz, Diş Hekimi",iletisim@docplanner.com; homepage-pro-banner@2x.webp,Mersin,diş hekimleri,https://www.doktortakvimi.com/hasret-borekci-gunduz/dis-hekimi/mersin?utm_source=google&utm_medium=gmb&utm_campaign=255394&utm_content=website,908503338344.0,"Bahçelievler Mahallesi H. Okan Merzeci Bulvarı 1858 Sokak No:480, 33140 Mersin, Türkiye"
Diş Hekimi Zeynep Akdoğan,bilgi@hekimler.net,Antalya,diş hekimleri,https://www.hekimler.net/zeynep-akdogan,905078045767.0,"Özgürlük, B, Namık Kemal Bl. No:46, 07025 Kepez/Antalya, Türkiye"
Turuncu Ağız Ve Diş Sağlığı Poliklinigi (Özdilek) - Стоматологическая клиника - Zahnarzt Klinik -,jane.doe@example.com; info@turuncudental.com,Antalya,diş hekimleri,http://www.turuncudental.com/,905060960100.0,"Fabrikalar, 3002. Sk. No:34, 07090 Kepez/Antalya, Türkiye"
Antares Ağız Ve Diş Sağlığı Polikliniği,info@antaresdental.com,Antalya,diş hekimleri,https://antaresdental.com/,905054953036.0,"Ahatlı, Ulusoy Cd. Gencer Apt No:42/A, 07090 Kepez/Antalya, Türkiye"
Diş Hekimi Hasan Akdoğan - Antalya Diş Hekimi - Antalya Dentist,,Antalya,diş hekimleri,https://www.dthasanakdogan.com/,905078045767.0,"Özgürlük, Namık Kemal Bl. Şenbay apt, 07025 Kepez/Antalya, Türkiye"
Özel Maredent Ağız ve Diş Sağlığı Polikliniği MAREDENT DENTAL CLINIC,info@maredent.com.tr; info@yourthemename.com; info@medicalprotheme.com,Antalya,diş hekimleri,https://www.maredent.com.tr/,902423346469.0,"Kanal, Halide Edip Cd. No:17, 07080 Kepez/Antalya, Türkiye"
Special Harmony Dental Clinic,info@ahenkdis.com,Antalya,diş hekimleri,http://ahenkdis.com/,902422428868.0,"Yeni Doğan, 3066. Sk. No:57, 07090 Kepez/Antalya, Türkiye"
Diş Hekimi Emrah Aydın,,Antalya,diş hekimleri,https://www.facebook.com/profile.php?id=566144136,902423346469.0,"Kanal Mh. Halide Edip Adıvar cad. İğdirli Apt No:7/2, 07080 Kepez/Antalya, Türkiye"
Diş Hekimi Narin Çil Sönmez,,Antalya,diş hekimleri,https://www.tavsiyeediyorum.com/dishekimi_5098_narincil_sonmez.htm,902423355424.0,"Sedir, Zambak Cd. No:2, 07010 Muratpaşa/Antalya, Türkiye"
IŞILTI Ağız ve Diş Sağlığı Polikliniği,605a7baede844d278b89dc95ae0a9123@sentry-next.wixpress.com; dd0a55ccb8124b9c9d938e3acf41f8aa@sentry.wixpress.com; c183baa23371454f99f417f6616b724d@sentry.wixpress.com; 8c4075d5481d476e945486754f783364@sentry.io; isiltilidisler@icloud.com; 8eb368c655b84e029ed79ad7a5c1718e@sentry.wixpress.com,Antalya,diş hekimleri,http://www.isiltilidisler.com/,902423253535.0,"Yeni Emek, Yıldırım Beyazıt Cd. No:116/A, 07060 Kepez/Antalya, Türkiye"
Özel Dinçalya Ağız ve Diş Sağlığı Polikliniği,,Antalya,diş hekimleri,https://www.dincalyasmile.com/,902423440789.0,"Güvenlik Mahallesi Vatan Bulvarı, 282. Sk. 45/B, 07030 Muratpaşa/Antalya, Türkiye"
Özel Atalya Ağız ve Diş Sağlığı Polikliniği,,Antalya,diş hekimleri,http://www.atalyadis.com/,905455266602.0,"Ulus, Mehmet Akif Cd. No:50/A, 07025 Kepez/Antalya, Türkiye"
"Dt. İrem Beceren, Diş Hekimi",iletisim@docplanner.com; homepage-pro-banner@2x.webp,Antalya,diş hekimleri,https://www.doktortakvimi.com/irem-beceren/dis-hekimi/antalya?utm_source=google&utm_medium=gmb&utm_campaign=242387&utm_content=website,,"Fabrikalar, 3002. Sk. No:34, 07090 Kepez/Antalya, Türkiye"
Diş Hekimi Hasan Gemici,,Antalya,diş hekimleri,http://www.hasangemici.com/,902423442121.0,"TÜRKİYE FİNANS BANKASI ÜZERİ, Ulus MAHALLESİ M. ERTEN İŞ MERKEZİ, Namık Kemal Bl. NO:14/5 D:3.KAT, 07025 Kepez/Antalya, Türkiye"
Özel Gülşen Çetin Ağız ve Diş Sağlığı Polikliniği,ihaz@rew.net; info@gulsencetindent.com,Antalya,diş hekimleri,http://www.gulsencetindent.com/,902423258383.0,"Zafer, Mehmet Akif Cd. No:127, 07025 Kepez/Antalya, Türkiye"
Dr. Hesna Kosen,,Antalya,diş hekimleri,http://www.firmasec.com/firma/rdfbcz-dr-hesna-kosen/,905323966006.0,"Özgürlük, Mehmet Akif Cd. Keskin Apt No:32 D:7, 07200 Kepez/Antalya, Türkiye"
Aspendos Ağız ve Diş Sağlığı Polikliniği,info@aspendosdental.com; dentalaspendos@gmail.com; email@aspendos.com,Antalya,diş hekimleri,https://aspendosdental.com/,905421300383.0,"Özgürlük, Mithat Paşa Cd. No:87/A, 07025 Kepez/Antalya, Türkiye"
"Dt. Merve Akalın Karataş, Diş Hekimi",iletisim@docplanner.com; user@domain.com.; homepage-pro-banner@2x.webp,Antalya,diş hekimleri,https://www.doktortakvimi.com/merve-akalin-karatas/dis-hekimi/antalya?utm_source=google&utm_medium=gmb&utm_campaign=277922&utm_content=website,908503338344.0,"Yeni Mahalle, Sakarya Blv. no: 281, 07090 Kepez/Antalya, Türkiye"
Prof. Dr. Sıddık Malkoç Ortodonti Kliniği,info@smortodonti.com,Antalya,diş hekimleri,http://www.smortodonti.com/,902423128090.0,"Yeşilbahçe Mah. Metin Kasapoğlu Cad. 1446 Sk No:21 Gökhan İş Merkezi B Blok Kat:1 Daire:2, 07160 Muratpaşa/Antalya, Türkiye"
Ortodent Dental Clinic,smile@ortodentclinic.com,Antalya,diş hekimleri,https://ortodentclinic.com/,905389757623.0,"Yeşilbahçe, Metin Kasapoğlu Cd. No:21/6, 07160 Muratpaşa/Antalya, Türkiye"
Diş Hekimi Yasemin Eski Erdoğan,dtlaradis@gmail.com,Antalya,diş hekimleri,http://www.laradis.com/,902423166444.0,"Yeşilbahçe, Metin Kasapoğlu Cd. No:44 K:1 D:7, 07160 Muratpaşa/Antalya, Türkiye"
asklinik Dental Health Clinic,info@asklinik.com.tr; selin@asklinik.com.tr; selhan@asklinik.com.tr,Antalya,diş hekimleri,http://www.asklinik.com.tr/,902423131616.0,"Yeşilbahçe Mah. Mustafa Parlak Apt. 43/A, Lara Cd., Muratpaşa/Antalya, Türkiye"
Özel IDH Süleyman Mert Ağız ve Diş Sağlığı Merkezi - Antalya Diş Hekimi - Antalya Dentist,info@idh.com.tr,Antalya,diş hekimleri,http://www.idh.com.tr/,902422433847.0,"Kültür, 3822. Sk. No:6, 07090 Kepez/Antalya, Türkiye"
Uzm. Dr. Cansu Bilginer Kılıç Diş Hekimi / Protez Uzmanı,,Antalya,diş hekimleri,http://cansubilginer.com/,905061983510.0,"Yeşilbahçe, Zafer Apt No:25/3, Metin Kasapoğlu Cd., 07230 Muratpaşa/Antalya, Türkiye"
Diş Hekimi Murat Özbıyık,,Antalya,diş hekimleri,http://www.muratdishekimi.com/,902423217878.0,"Yeşilbahçe Mah. Metin Kasapoğlu Cad, Sevgi Apt No:3 D:1, 07160 Muratpaşa, Türkiye"
Diş Hekimi Adnan Adalı,info@adnanadali.com,Antalya,diş hekimleri,http://www.adnanadali.com/,902423164470.0,"Metin Kasapoğlu cd. No:71 Yeşilbahçe mah. Arkadaş apt, Kat: 1, 07160 Muratpaşa/Antalya, Türkiye"
Diş Hekimi Tevfik Bağdatlıoğlu,605a7baede844d278b89dc95ae0a9123@sentry-next.wixpress.com; dd0a55ccb8124b9c9d938e3acf41f8aa@sentry.wixpress.com; c183baa23371454f99f417f6616b724d@sentry.wixpress.com; 8c4075d5481d476e945486754f783364@sentry.io; info@bagdatlioglu.net; 79baaa8e09c746d2b7401643b99792e0@sentry.wixpress.com; 8eb368c655b84e029ed79ad7a5c1718e@sentry.wixpress.com,Antalya,diş hekimleri,http://www.dentistantalya.net/,902423111161.0,"Yeşilbahçe Mah. 1451.Sok. No:2 Hakkı Uzunoğlu Apt, K:1 D:8, 07160 Muratpaşa/Antalya, Türkiye"
Diş Hekimi Engin Gökbayrak,,Antalya,diş hekimleri,http://www.dtengingokbayrak.com/,902422484866.0,"Pınarpaşı mah Atatürk bulvarı 702 sokak no:19 kat :2 daire: 4, 07070 Konyaaltı/Antalya, Türkiye"
Diş Hekimi Ezgi Özkan Özben,info@dtezgiozkan.com; dt.ezgiozkan@hotmail.com,Antalya,diş hekimleri,http://www.dtezgiozkan.com/,902422304888.0,"Arapsuyu mahallesi, Atatürk Blv.,Gökay Plaza No:23 Kat:4 daire:14, 07070 Konyaaltı/Antalya, Türkiye"
Diş Hekimi Onur Özdoğan,Support@example.com; info@dtonurozdogan.com; dtonurozdogan@gmail.com,Antalya,diş hekimleri,http://www.dtonurozdogan.com/,905452204288.0,"Meltem Mah.,Meltem Bulv., Antalyaspor Sitesi Apt. No:16 B 2 Blok Kat:2 No:3, 07030 Muratpaşa/Antalya, Türkiye"
Diş Hekimi Oktay Aykut Engür,info@dentalsmile.art,Antalya,diş hekimleri,http://www.dentalsmile.art/,905551970752.0,"Bahçelievler, Murat Apartmanı, Konyaaltı Cd. 44/3, 07050 Muratpaşa/Antalya, Türkiye"
Diş Hekimi Cem Çırakoğlu,605a7baede844d278b89dc95ae0a9123@sentry-next.wixpress.com; dt@cemcirakoglu.com; 8c4075d5481d476e945486754f783364@sentry.io,Antalya,diş hekimleri,http://www.cemcirakoglu.com/,902422908872.0,"Şirinyalı, Yılmaz Apt, 1492. Sk. No:1 D:2, 07160 Muratpaşa/Antalya, Türkiye"
Özel Mira Ağız ve Diş Sağlığı Polikliniği,info@miraklinik.com,Antalya,diş hekimleri,http://www.miraklinik.com/,905522330077.0,"Yeni, Aliya Izzet Begoviç Cd no:41/A, 07060 Kepez/Antalya, Türkiye"
Diş Hekimi Dt.Ahmet Kıvanç Göldağ,,Antalya,diş hekimleri,https://www.doktorsitesi.com/ahmet-kivanc-goldag/dis-hekimi-agiz-dis-ve-cene-cerrahisi/antalya,905518322397.0,"Barış, Barış Manço Blv. No:71/A, 07080 Kepez/Antalya, Türkiye"
MRV Dental Ağız Ve Diş Sağlığı Polikliniği,info@mrvdental.com,Antalya,diş hekimleri,http://www.mrvdental.com/,905077472247.0,"Yeni, Sakarya Blv. No:281, 07060 Kepez/Antalya, Türkiye"
Palmiye Ağız ve Diş Sağlığı Polikliniği,kvkk@palmiyedis.com; info@palmiyedental.com,Antalya,diş hekimleri,http://www.palmiyedis.com/,905012447007.0,"Teomanpaşa, Yeşilırmak Cd. No:14, 07260 Kepez/Antalya, Türkiye"
Defne Ağız ve Diş Sağlığı Polikliniği,wght@9..; defnedispoliklinigi@gmail.com,Antalya,diş hekimleri,http://www.defnesmile.com/,905531366096.0,"Yeni Emek, 2581. Sk. 4/B, 07060 Kepez/Antalya, Türkiye"
Universal Dental Turkey,info@universaldentalturkey.com,Antalya,diş hekimleri,https://universaldentalturkey.com/,902422120044.0,"Gülveren, 75. Yıl Cd. no:3, 07220 Kepez/Antalya, Türkiye"
International Dental Hospital,,Antalya,diş hekimleri,http://www.internationaldentalhospital.com/,905059147871.0,"Kültür, 3822. Sk. No:6, 07090 Kepez/Antalya, Türkiye"
"Uzm. Dt. Fırat Ergin, Endodonti",iletisim@docplanner.com; user@domain.com.; homepage-pro-banner@2x.webp,Antalya,diş hekimleri,https://www.doktortakvimi.com/firat-ergin-2/endodonti-dis-hekimi/antalya?utm_source=google&utm_medium=gmb&utm_campaign=240826&utm_content=website,908503338344.0,"Kültür, 3822. Sk. No:6, 07090 Kepez/Antalya, Türkiye"
Markasya Ağız Ve Diş Sağlığı Polikliniği,info@markasyadis.com,Antalya,diş hekimleri,http://markasyadis.com/,902422418162.0,"Toros, Kurgu Plaza, 805. Sk. 14/1, 07070 Konyaaltı/Antalya, Türkiye"
Diş Hekimi Nimet ÇETİN,605a7baede844d278b89dc95ae0a9123@sentry-next.wixpress.com; dd0a55ccb8124b9c9d938e3acf41f8aa@sentry.wixpress.com; c183baa23371454f99f417f6616b724d@sentry.wixpress.com; 8c4075d5481d476e945486754f783364@sentry.io; info@nimetcetin.com,Antalya,diş hekimleri,https://www.nimetcetin.com/,902422289292.0,"Arapsuyu, Atatürk Blv. No:29, Kat:1, 07070 Konyaaltı/Antalya, Türkiye"
Diş Hekimi Serdar Özkan,dt@serdarozkan.com.tr,Antalya,diş hekimleri,http://www.serdarozkan.com.tr/,902422439369.0,"Tahılpazarı, Kazım Özalp Cd. Tugayoğlu İşhanı N:122/13, 07140 Muratpaşa/Antalya, Türkiye"
Diş Hekimi (dentist) Mustafa Küçükterci,mustafa.kucukterci@hs01.kep.tr; sifadisantalya@gmail.com,Antalya,diş hekimleri,http://www.dtmustafakucukterci.com/,905064277730.0,"Etiler, 838. Sk. No:6 daire:3, 07010 Muratpaşa/Antalya, Türkiye"
Diş Hekimi Sümeyye OĞUZ,homepage-pro-banner@2x.webp,Antalya,diş hekimleri,https://www.doktortakvimi.com/sumeyye-oguz/dis-hekimi/antalya,905396271042.0,"Demircikara, Burhanettin Onat Cd. Ak sitesi D:47/2, 07040 Muratpaşa/Antalya, Türkiye"
Diş Hekimi İrem Nur Özdemir,,Antalya,diş hekimleri,http://www.iremnurozdemir.com/,905309065070.0,"Demircikara, Ocean City, Burhanettin Onat Caddesi, 1419. Sk. No: 59 C Blok Kat:1 Daire:2, 07100 Muratpaşa/Antalya, Türkiye"
Antlara Dental Clinic | Antlara Ağız ve Diş Sağlığı Polikliniği,smile@antlaradental.com; antlaraklinik@gmail.com,Antalya,diş hekimleri,https://www.antlaradental.com/,902423245779.0,"Zümrütova, Sinanoğlu Cd. No:53A, 07230 Muratpaşa/Antalya, Türkiye"
Dr. Şahbazoğlu Diş Kliniği,,Antalya,diş hekimleri,http://www.drsahbazoglu.com/,902423161515.0,"Şirinyalı, 1500. Sk. No:1, 07160 Muratpaşa/Antalya, Türkiye"
Hospitadent Antalya Diş Hastanesi,,Antalya,diş hekimleri,http://www.hospitadent.com/,902424555999.0,"Demircikara Mahallesi Burhanettin Onat Caddesi Ocean City no:59B/D, 07100 Muratpaşa/Antalya, Türkiye"
ÖNAL DİŞ POLİKLİNİĞİ (DENTONAL),onalklinik@gmail.com,Antalya,diş hekimleri,http://dentonalturkey.com/,905336644054.0,"Zümrütova, Sinanoğlu Cd. Hatice Çelik Apt D:37/B, 07200 Muratpaşa/Antalya, Türkiye"
Özel Egedent Ağız ve Diş Sağlığı Polikliniği,,Antalya,diş hekimleri,http://www.egedentantalya.com/,905074073507.0,"Meydankavağı, 12. Cd. No:43/a, 07200 Muratpaşa/Antalya, Türkiye"
"Dr. Dt. Kerem Aşkın, Diş Hekimi",iletisim@docplanner.com; user@domain.com.; homepage-pro-banner@2x.webp,Antalya,diş hekimleri,https://www.doktortakvimi.com/kerem-askin/dis-hekimi-endodonti-dis-hastaliklari-ve-tedavisi/antalya?utm_source=google&utm_medium=gmb&utm_campaign=131804&utm_content=website,,"Yeşilbahçe, Metin Kasapoğlu Cd. Yakamoz Sitesi No:58/2 B Blok, 07230 Muratpaşa/Antalya, Türkiye"
Alp's Dental Clinic,,Antalya,diş hekimleri,http://alpsdentalclinic.com/,905312616255.0,"Yeşilbahçe, 1471. Sk. No:3C, 07160 Muratpaşa/Antalya, Türkiye"
AtlasDent Ağız ve Diş Sağlığı Polikliniği,info@atlasdent.com.tr,Antalya,diş hekimleri,http://atlasdent.com.tr/,902423130066.0,"Meydankavağı, Avni Tolunay Cd. Altemir Apt No:85/B, 07230 Muratpaşa/Antalya, Türkiye"
Diş Hekimi Dr. Çiğdem Şekerci,,Antalya,diş hekimleri,http://www.perilidislerklinigi.com/,902422474959.0,"Yeşilbahçe Mah., Metin Kasapoğlu Cad.,, Yakamoz Sit. B Blok No:58/1, 07160 Muratpaşa/Antalya, Türkiye"
OZClinic Ağız ve Diş Sağlığı Polikliniği - OZClinic Dental Centre,info@ozclinic.com.tr; info@estheticdentalturkey.com,Antalya,diş hekimleri,http://www.ozclinic.com.tr/,905532528622.0,"Demircikara, Avni Tolunay Cd. No:34B, 07100 Muratpaşa/Antalya, Türkiye"
Tml Smile Ağız ve Diş Sağlığı Polikliniği,info@tmlsmile.com,Antalya,diş hekimleri,https://tmlsmilestudio.com/,905521808864.0,"Zümrütova, Hatice Çevik Apartmanı, Sinanoğlu Cd. No:37/ C, 07230 Muratpaşa/Antalya, Türkiye"
DR.GÜRAY UYSAL,info@antasyadental.com,Antalya,diş hekimleri,https://www.dtgurayuysal.com/,905374409191.0,"Üçgen, ALAY MÜFTÜSÜ İŞHANI, Anafartalar Cd. NO 80/G, 07050 Muratpaşa/Antalya, Türkiye"
Özdemir Dental Center Antalya,bulentkanevet@yahoo.com; dnterdem@gmail.com; berkekucuk@outlook.com; bureydeee07@gmail.com; zeynepozkanmetu@gmail.com; info@ozdemirdentalcenter.com; emre.demir20@icloud.com,Antalya,diş hekimleri,https://ozdemirdentalcenter.com/,905453161434.0,"Yeşilbahçe, Çınarlı Cd. No:11/C, 07160 Muratpaşa/Antalya, Türkiye"
Zorlu Diş Polikliniği (Healthio Turkey),info@zorludis.com; info@medwell.com,Antalya,diş hekimleri,http://zorludis.com/,905558024220.0,"Altındağ, Anafartalar Cd. No: 95/ C, 07050 Muratpaşa/Antalya, Türkiye"
Medical Dental Turkey,info@medicaldentalturkey.com,Antalya,diş hekimleri,https://medicaldentalturkey.com/,447500277072.0,"Meydankavağı, İsmail Cem Cd No:10, 07230 Muratpaşa/Antalya, Türkiye"
BilimDent Ağız ve Diş Sağlığı Uygulama ve Araştırma Merkezi,bilimdent@antalya.edu.tr,Antalya,diş hekimleri,https://bilimdent.com/,905442450091.0,"Tahılpazarı, Kazım Özalp Cd. No:84 Kat 9, 07040 Muratpaşa/Antalya, Türkiye"
Antalya Dent15 Ağız ve Diş Sağlığı Polikliniği,antalyadent15@gmail.com,Antalya,diş hekimleri,http://www.antalyadent15.com/,902424088878.0,"Güvenlik, Anafartalar Cd. No:149 K:1 D:1, 07030 Muratpaşa/Antalya, Türkiye"
Özel GG Smile Clinic Ağız ve Diş Sağlığı Polikliniği,gokhansavasci@gmail.com; ggsmileclinic@gmail.com,Antalya,diş hekimleri,http://www.ggsmileclinic.com/,905346377720.0,"Üçgen, GG Smile Clinic Ağız ve Diş Sağlığı Polikliniği, 07040 Muratpaşa/Antalya, Türkiye"
DİŞ HEKİMİ HÜSEYİN KENAN ÖZKAN,dt_kenan@yahoo.com,Antalya,diş hekimleri,http://www.hkenanozkan.com/,902423354079.0,"Memurevleri, Derya Cd. No:1 D:6, 07050 Muratpaşa/Antalya, Türkiye"
Diş Hekimi Aysel Uysal Kulalı,,Antalya,diş hekimleri,https://www.instagram.com/dishekimiayselkulali/?igshid=tjlbnopqmxay,902422447454.0,"Kızılsaray, 77. Sk. No:10, 07040 Muratpaşa/Antalya, Türkiye"
Dr. Bulent Surme,,Antalya,diş hekimleri,https://iyifirma.com/dr-bulent-surme/,902422477749.0,"Altındağ, Trt Cad. Sarıgül Apt. No:18 D:5, 07050 Muratpaşa/Antalya, Türkiye"
Diş Hekimi - Dt. Hasan Kaçaroğlu - Antalya,info@drhasankacaroglu.com,Antalya,diş hekimleri,https://www.drhasankacaroglu.com/,902423110044.0,"Gençlik, Tevfik Işık Cd. Cumhuriyet Apt No:15/2, 07160 Muratpaşa/Antalya, Türkiye"
Diş Hekimi Orhan Karadağ,iletisim@docplanner.com; homepage-pro-banner@2x.webp,Antalya,diş hekimleri,https://www.doktortakvimi.com/orhan-karadag-2/dis-hekimi/antalya,902422416742.0,"Gençlik Mahallesi Tevfik Işık Caddesi Fener Apt. No:1 D:No: 7, 07100 Muratpaşa, Türkiye"
diş hekimi Mehmet GÜNGÖRDÜ,,Antalya,diş hekimleri,http://www.mgungordu.com/,902422435623.0,"Muratpaşa, Fevzi Çakmak Caddesi. 1316 Sok. NO:2 horasan apt. kat:1, 07100 Antalya, Türkiye"
Dentists Ali Yigit DEMİRCİ,info@antalyadis.com,Antalya,diş hekimleri,http://www.antalyadis.com/,902423120800.0,"Yeşilbahçe, Metin Kasapoğlu Cd. Ayhan Kadam İş Merkezi 48A Kat:6 Daire:12, 07100 Muratpaşa/Antalya, Türkiye"
Uzm. Dt. Mete Vural Kanal Tedavisi Uzmanı,info@metevural.com.tr,Antalya,diş hekimleri,https://www.metevural.com.tr/,905325110178.0,"Yeşilbahçe, Metin Kasapoğlu Cd. Ayhan Kadam İş Merkezi No:48/A, 07230 Muratpaşa/Antalya, Türkiye"
Özel Meladent Ağız ve Diş Sağlığı Polikliniği,meladent.adsp@gmail.com,Antalya,diş hekimleri,https://meladent.com.tr/index.html,905326447307.0,"Meydankavağı, Avni Tolunay Cd. No:77A B Blok, 07200 Muratpaşa/Antalya, Türkiye"
Uzm.Dt Abdullah Başoğlu,info@dentprofs.com,Antalya,diş hekimleri,https://dentprofs.com/,908504743133.0,"Yeşilbahçe, Metin Kasapoğlu Cd. Bakır Apartmanı No:35 K:1 Daire:1, 07160 Muratpaşa/Antalya, Türkiye"
Özel Bronze Ağız ve Diş Sağlığı Polikliniği,info@bronzedentalclinic.com,Antalya,diş hekimleri,http://www.bronzedentalclinic.com/,905435045557.0,"Yenigün, Mevlana Cd. No:64/A, 07310 Muratpaşa/Antalya, Türkiye"
Beren Smile Point / İmplant/veneer / Teeth Whıtening / Hollywood Smile / Smile Macke Over / All on 4 / Zirconium,info@berensmilepoint.com,Antalya,diş hekimleri,https://www.berensmilepoint.com/,902422488080.0,"Üçgen, Tonguç Cd. No:38, 07040 Muratpaşa/Antalya, Türkiye"
Optimum ağız ve diş sağlığı polikliniği,,Antalya,diş hekimleri,http://optimumantalya.com/,905522160543.0,"Etiler, 882. Sk. No:21, 07010 Muratpaşa/Antalya, Türkiye"
"Uzm. Dt. Oğuz Senek, Çocuk Diş Hekimliği (Pedodonti)",iletisim@docplanner.com; user@domain.com.; homepage-pro-banner@2x.webp,Antalya,diş hekimleri,https://www.doktortakvimi.com/oguz-senek/cocuk-dis-hekimligi-pedodonti/antalya?utm_source=google&utm_medium=gmb&utm_campaign=243149&utm_content=website,908503338344.0,"Etiler, Adnan Menderes Blv. No:61, 07010 Muratpaşa/Antalya, Türkiye"
"Dt. Ayşegül Demiralay, Diş Hekimi",iletisim@docplanner.com; user@domain.com.; homepage-pro-banner@2x.webp,Antalya,diş hekimleri,https://www.doktortakvimi.com/aysegul-demiralay-2/dis-hekimi/antalya?utm_source=google&utm_medium=gmb&utm_campaign=263462&utm_content=website,,"Meydankavağı, Lilium Hadrianus Sitesi, İsmail Cem Cd no:43/A, 07230 Muratpaşa/Antalya, Türkiye"
Çocuk Diş Hekimi Oğuz SENEK (Pedodontist),,Antalya,diş hekimleri,https://www.instagram.com/cocukdishekimi_antalya?igsh=MWpudnQ1eXFqN2h4cw==,905364555308.0,"Zümrütova, Sinanoğlu Cd. Yalçın apt no:23 kat:1 daire:8, 07700 Muratpaşa/Antalya, Türkiye"
Diş Hekimi Hatice Gülen Savaşer,,Antalya,diş hekimleri,https://www.dtgulensavaser.com/,902422412441.0,"Yuva, Gençlik Mah, Işıklar Cd. No:10/5 Apt. Kat:3, 07100 Muratpaşa/Antalya, Türkiye"
WeSmile Dental Clinic Antalya,info@maredent.com.tr; info@yourthemename.com; info@medicalprotheme.com,Antalya,diş hekimleri,https://www.maredent.com.tr/,902423214333.0,"Yeşilbahçe mahallesi,metin kasapoğlu cad.no:48/a ayhan kadam iş merkezi, 07090 Antalya, Türkiye"
WeCure Antalya,,Antalya,diş hekimleri,https://wecure.co.uk/,447700165777.0,"Gençlik Mahallesi 1330 Sokak Güneş Ap, No:11/2, 07100 Muratpaşa/Antalya, Türkiye"
