title,email,state,searchString,website,phoneUnformatted,address
Diş hekimi Ersoy TEKİN,İnfo@ersoytekin.com,İstanbul,diş hekimleri,http://www.ersoytekin.com/,902125305118.0,"Koca Mustafapaşa, kuvayimilliye cad. silivrikapı mah.no 50:1, 34107 Fatih/İstanbul, Türkiye"
Çocuk Diş Hekimi Sevnur İlter,,İstanbul,diş hekimleri,https://instagram.com/guleryuzadsp?igshid=YmMyMTA2M2Y=,905428398558.0,"Kirazlı, Güleryüz Ağız ve Diş Sağlığı Polikliniği, 1175. Sk. 7 G, 34210 Bağcılar/İstanbul, Türkiye"
DİŞ HEKİMİ DENİZ KAPTAN ZAMAN,,İstanbul,diş hekimleri,http://dishekimidenizkaptanzaman.com/,902124793130.0,"Yıldırım, Millet Cd. No:74 K:2 D:3, 34045 Bayrampaşa/İstanbul, Türkiye"
Diş Hekimi Resul İLTER,,İstanbul,diş hekimleri,https://instagram.com/guleryuzadsp?igshid=YmMyMTA2M2Y=,905428398558.0,"Kirazlı, Güleryüz Diş Kliniği, Kirazlı Metro yanı, 1175. Sk. 1-7 G, 34210 Bağcılar/İstanbul, Türkiye"
Bağcılar Ağız ve Diş Sağlığı Hastanesi,mhrsyardim@saglik.gov.tr; sb@hs01.kep.tr; istbagcilar.adshhh@saglik.gov.tr; bilgiguvenligi@saglik.gov.tr,İstanbul,diş hekimleri,https://bagcilaradsh.saglik.gov.tr/,902125150505.0,"Demirkapı, Velioğlu Cd. No:93, 34218 Bağcılar/İstanbul, Türkiye"
Diş Hekimi Zekiye Güler,,İstanbul,diş hekimleri,https://turkmia.org/Di%C5%9F+Hekimi+Zekiye+G%C3%BCler-535434,902126476187.0,"Fatih, Fatih Cad. & 289. Sokak No:1, 34225 Esenler/İstanbul, Türkiye"
"Dt. Eyüp Bozkırlı, Diş Hekimi",iletisim@docplanner.com; homepage-pro-banner@2x.webp,İstanbul,diş hekimleri,https://www.doktortakvimi.com/eyup-bozkirli/dis-hekimi/istanbul?utm_source=google&utm_medium=gmb&utm_campaign=231594&utm_content=website,,"Nine Hatun, Ayazma Cd. No:76/A, 34220 Esenler/İstanbul, Türkiye"
Diş Hekimi Ceyda Ünal,,İstanbul,diş hekimleri,https://www.doktorsitesi.com/dt-ceyda-unal/dis-hekimi/istanbul,905383511002.0,"Feneryolu Mahallesi Fahrettin Kerim Gökay Caddesi, Bina No: 68/1 Leylak Apt Arka Blok Daire:3, 34724 Kadıköy/İstanbul, Türkiye"
Diş Hekimi Emre Aldoğan,info@alpdent.net; info@alpdent.com.tr,İstanbul,diş hekimleri,http://www.alpdent.net/,905325824050.0,"Kadıköy, OPTİMİST RESİDENCE, Yıldırım Sk. No:10/8, 34720 Kadıköy/İstanbul, Türkiye"
Deniz İnce - Kadıköy Diş Hekimi,international@dentince.com; aslihanaksungarerkul@dentince.com; deniz@dentince.com; sevdayetkn@gmail.com; murat@dentince.com; info@dentince.com,İstanbul,diş hekimleri,https://dentince.com/,902163452183.0,"Eğitim, Fahrettin Kerim Gökay Cd No:107 D:109B, 34722 Kadıköy/İstanbul, Türkiye"
Dr. Sedat Burdurlu,info@a1dent.com.tr,İstanbul,diş hekimleri,http://www.a1dent.com.tr/,902163462122.0,"rasimpaşa mah Söğütlüçeşme Cad. Kardeşler Apt. No:125, D:2, 34000 Kadıköy/İstanbul, Türkiye"
"Doç. Dr. Fatıma Betül Baştürk, Diş Hekimi",info@fatimabasturk.com,İstanbul,diş hekimleri,http://www.fatimabasturk.com/,905331450566.0,"Acıbadem, Acıbadem Cd. No:158 D:17, 34660 Üsküdar/İstanbul, Türkiye"
"Dt. Ömer Faruk Yılmaz, Diş Hekimi",homepage-pro-banner@2x.webp,İstanbul,diş hekimleri,https://www.doktortakvimi.com/omer-faruk-yilmaz-2/dis-hekimi/istanbul?utm_source=google&utm_medium=gmb&utm_campaign=254073&utm_content=website,,"Göktürk Merkez Mh.İstanbul Cd. No:56/H Yalın Evler Sitesi, 34077 İstanbul, Türkiye"
"Dt. Bilal Baltacı, Diş Hekimi",iletisim@docplanner.com; homepage-pro-banner@2x.webp,İstanbul,diş hekimleri,https://www.doktortakvimi.com/bilal-baltaci/dis-hekimi/istanbul?utm_source=google&utm_medium=gmb&utm_campaign=233608&utm_content=website,,"Nine Hatun, Ayazma Cd. No:76/A, 34220 Esenler/İstanbul, Türkiye"
"Dt. Esranur Çelik, Diş Hekimi",homepage-pro-banner@2x.webp,İstanbul,diş hekimleri,https://www.doktortakvimi.com/esranur-celik/dis-hekimi/istanbul?utm_source=google&utm_medium=gmb&utm_campaign=239695&utm_content=website,908503338344.0,"Kocatepe, 33. Sk. No: 5/A, 34045 Bayrampaşa/İstanbul, Türkiye"
Diş Hekimi Kadir KOĞUK,,İstanbul,diş hekimleri,http://www.esenlerdis.com/iletisim.php?lng=turkish,902126101044.0,"Fevzi Çakmak, 1907. Sk. No:1, 34204 Esenler/İstanbul, Türkiye"
"Dt. Müslüm Tatlı, Diş Hekimi",homepage-pro-banner@2x.webp,İstanbul,diş hekimleri,https://www.doktortakvimi.com/muslum-tatli/dis-hekimi/istanbul?utm_source=google&utm_medium=gmb&utm_campaign=251880&utm_content=website,908503338344.0,"İnönü, Hoca Ahmet Yesevi Cd. No:9-A, 34203 Bağcılar/İstanbul, Türkiye"
İstanbul Diş Hekimi-Dr. Dt. Ayşegül Mekikoğlu,,İstanbul,diş hekimleri,http://www.aysegulmekikoglu.com/,905076538753.0,"Fenerbahçe, Fener Kalamış Cd. No:17 Daire:4, 34726 Kadıköy/İstanbul, Türkiye"
Diş Hekimi Ferdi Çelik,,İstanbul,diş hekimleri,http://www.dtferdicelik.com/,905393217876.0,"Feneryolu Mahallesi Bağdat Caddesi Hacer Hanım Apartmanı, no:145 Daire:9, 34724 Kadıköy/İstanbul, Türkiye"
Dr. Ilker Erdogan,,İstanbul,diş hekimleri,http://www.ilkererdogan.com/en/iletisim.htm,902165505252.0,"Zühtüpaşa, Pembe Köşk, Münir Nurettin Selçuk Cd. No:60, 34724 Kadıköy/İstanbul, Türkiye"
Diş Hekimi Selman Sadak,info@selmansadak.com,İstanbul,diş hekimleri,http://www.selmansadak.com/,905411709622.0,"Fenerbahçe, Selcan Apartmanı, Bağdat Cad. No:208 Kat 3 Daire 4, 34728 Kadıköy/İstanbul, Türkiye"
Dr. Tolga Yasa,,İstanbul,diş hekimleri,http://www.tolgayasa.com/,902165450249.0,"Acıbadem, Acıbadem İş Bankası, İbrahimağa Konutları A 4 Blok D:3, 34718 Kadıköy/İstanbul, Türkiye"
Dr.Digdem Findik,,İstanbul,diş hekimleri,http://www.dtfindik.com/,902163633716.0,"Fenerbahçe, Bağdat Cad. Temel Apartmanı No:146 Daire 9 Kat 4, 34728 Kadıköy/İstanbul, Türkiye"
"Dt. Zeynep Melis Güler, Diş Hekimi",iletisim@docplanner.com; user@domain.com.; homepage-pro-banner@2x.webp,İstanbul,diş hekimleri,https://www.doktortakvimi.com/zeynep-melis-guler/dis-hekimi/istanbul?utm_source=google&utm_medium=gmb&utm_campaign=265099&utm_content=website,905068603368.0,"Fikirtepe, Rüzgar Sk. No:44 A1 blok, 34720, 34720 Kadıköy/İstanbul, Türkiye"
Şevket Tunalı Diş Hekimi,info@sevkettunali.com; wordpress@sevkettunali.com,İstanbul,diş hekimleri,http://www.sevkettunali.com/,902163478464.0,"Fenerbahçe, Fener Kalamış Cd., 34726 Kadıköy/İstanbul, Türkiye"
Diş Hekimi Ali Berkman,iletisim@docplanner.com; user@domain.com.; homepage-pro-banner@2x.webp,İstanbul,diş hekimleri,https://www.doktortakvimi.com/ali-berkman/dis-hekimi/istanbul#tab=profile-reviews?utm_source=google&utm_medium=gmb&utm_campaign=145170&utm_content=post_book_now,902163589239.0,"Feneryolu, Murat, Mustafa Mazhar Bey Sokağı No 59 apt. D 2, 34726 Kadıköy/İstanbul, Türkiye"
"Dt. Seyfettin Yanık, Diş Hekimi",homepage-pro-banner@2x.webp,İstanbul,diş hekimleri,https://www.doktortakvimi.com/seyfettin-yanik/dis-hekimi/istanbul?utm_source=google&utm_medium=gmb&utm_campaign=166322&utm_content=website,,"Merkezefendi Mahallesi Gümüşsuyu Davutpaşa Caddesi, G-54. Sk., 34015 İstanbul, Türkiye"
Diş Hekimi Burhan Metin Yıkılmaz,,İstanbul,diş hekimleri,https://www.disrandevum.com/burhan-metin-yikilmaz/dis-hekimi/istanbul/,902163458130.0,"Hasanpaşa, Kurbağalıdere Cd. No:79 D:B, 34722 Kadıköy/İstanbul, Türkiye"
"Dr. Dt. Münip Çolakoğlu, Diş Hekimi",iletisim@docplanner.com; user@domain.com.; homepage-pro-banner@2x.webp,İstanbul,diş hekimleri,https://www.doktortakvimi.com/munip-colakoglu-2/dis-hekimi-endodonti/istanbul?utm_source=google&utm_medium=gmb&utm_campaign=238525&utm_content=website,908503338344.0,"Şehremini, Büyük Saray Meydanı Cd. 62/B, 34104 Fatih/İstanbul, Türkiye"
Diş Hekimi Dr. Oya Erten,,İstanbul,diş hekimleri,http://www.oyaerten.com/,905372844550.0,"Altunizade Mahallesi Ord. Prof. Dr. Fahrettin Kerim Gökay Caddesi Ekşi İş Merkezi, No:12 D:5, 34662 Üsküdar/İstanbul, Türkiye"
"Dt. Emel Çakır Sütcü, Diş Hekimi",iletisim@docplanner.com; user@domain.com.; homepage-pro-banner@2x.webp,İstanbul,diş hekimleri,https://www.doktortakvimi.com/emel-cakir-sutcu/dis-hekimi/istanbul?utm_source=google&utm_medium=gmb&utm_campaign=149854&utm_content=website,,"Kartaltepe, Terakki Cd. No:16/1-3, 34145 Bakırköy/İstanbul, Türkiye"
"Dt. Nizamettin Arık, Diş Hekimi",homepage-pro-banner@2x.webp,İstanbul,diş hekimleri,https://www.doktortakvimi.com/nizamettin-arik/dis-hekimi/istanbul?utm_source=google&utm_medium=gmb&utm_campaign=145772&utm_content=post_book_now,,"Çırpıcı, Rüstem Balkan Sk. No:55/A, 34025 Zeytinburnu/İstanbul, Türkiye"
Diş Hekimi Prof. Dr. Umut Çakan,info@umutcakan.com.tr; umutcakanklinik@gmail.com,İstanbul,diş hekimleri,http://www.umutcakan.com.tr/,902167660788.0,"Feneryolu, Hasan Amir Sk. Dursoy İş Merkezi No:4 Kat 2 Daire:6, 34724 Kadıköy/İstanbul, Türkiye"
Prof.Dr.Deniz Gemalmaz muayenehanesi,denizgemalmaz@gmail.com,İstanbul,diş hekimleri,https://denizgemalmaz.com.tr/,902163553965.0,"Bağdat Caddesi Fenerbahçe Mahallesi No:160 Daire: 19, 34726 Kadıköy/İstanbul, Türkiye"
"Dt. Alpay Hava, Diş Hekimi",homepage-pro-banner@2x.webp,İstanbul,diş hekimleri,https://www.doktortakvimi.com/alpay-hava/dis-hekimi/istanbul?utm_source=google&utm_medium=gmb&utm_campaign=148004&utm_content=website,908503338344.0,"Fenerbahçe, Körfez Ap, Fener Kalamış Cd. No:17/4, 34726 Kadıköy/İstanbul, Türkiye"
Acil Diş Hastanesi İstanbul Gece 24 Saat Açık Nöbetçi Diş Hekimi Anadolu Yakası ve Avrupa Yakası,Sev81@hotmail.be,İstanbul,diş hekimleri,http://www.eniyident.com/uskudar-disci.htm,905335828279.0,"Altunizade mahallesi kuşbakışı caddesi No 5/b-c-d, 34662 Üsküdar/İstanbul, Türkiye"
"Dt. Görkem Göksoy, Diş Hekimi",iletisim@docplanner.com; user@domain.com.; homepage-pro-banner@2x.webp,İstanbul,diş hekimleri,https://www.doktortakvimi.com/gorkem-goksoy/dis-hekimi/istanbul?utm_source=google&utm_medium=gmb&utm_campaign=246109&utm_content=website,,"Altunizade, Nuhkuyusu Cd No:90B, 34662 Üsküdar/İstanbul, Türkiye"
Oral Sağlık Kadıköy (Diş Hekimi Çiçek Serdaroğlu),,İstanbul,diş hekimleri,http://oralsaglik.org/?utm_source=gmb&utm_medium=referral,902165454425.0,"Acıbadem Caddesi, İbrahimağa konutları, B2/A, blok, Daire:8, 34718 Kadıköy/İstanbul, Türkiye"
Diş hekimi Y.Doç.Dr. Mert Uçankale,,İstanbul,diş hekimleri,http://www.estetikdisler.com/,905326443368.0,"Fenerbahçe, Mutlu Residance, Bağdat Cad. No:84/1c D:14, 34726, 34726 Kadıköy/İstanbul, Türkiye"
DİŞ HEKİMİ ALİ SERİN,,İstanbul,diş hekimleri,https://www.doktortakvimi.com/ali-serin-2/dis-hekimi/kad%C4%B1k%C3%B6y,905458078687.0,"KOŞUYOLU CADDESİ, Kalfa Çeşmesi Sk. No:2 D:1, 34718 Kadıköy/İstanbul, Türkiye"
"Dt. Agah Can, Diş Hekimi",homepage-pro-banner@2x.webp,İstanbul,diş hekimleri,https://www.doktortakvimi.com/agah-can/dis-hekimi/istanbul?utm_source=google&utm_medium=gmb&utm_campaign=151242&utm_content=website,,"Koşuyolu, Koşuyolu Cd. No:30, 34718 Kadıköy/İstanbul, Türkiye"
Diş Hekimi M. Hakan Gür,,İstanbul,diş hekimleri,http://www.hakangur.com/,902163422423.0,"Valide-i Atik, Nuhkuyusu Cd Gökdemir Apt. No:227 D:6, 34644 Üsküdar/İstanbul, Türkiye"
Diş Hekimi Deniz IŞIK Çene Cerrahisi Uzmanı Kadıköy İmplant,info@denizisik.org,İstanbul,diş hekimleri,http://www.denizisik.org/,905536683368.0,"Fenerbahçe, Bağdat Cad. No:206, 34726 Kadıköy/İstanbul, Türkiye"
Hospitadent Dental Spa Göktürk,,İstanbul,diş hekimleri,https://www.hospitadent.com/,902124000068.0,"Göktürk Merkez Mahallesi İstanbul Caddesi Yalınevler No:56 H, 34077 Eyüpsultan/İstanbul, Türkiye"
"Dt. Mustafa Söylemez, Diş Hekimi",homepage-pro-banner@2x.webp,İstanbul,diş hekimleri,https://www.doktortakvimi.com/mustafa-soylemez/dis-hekimi/istanbul?utm_source=google&utm_medium=gmb&utm_campaign=143610&utm_content=website,,"Akşemsettin, Akdeniz Cd. No:28, 34080 Fatih/İstanbul, Türkiye"
"Dt. Hediye Şahin, Diş Hekimi",homepage-pro-banner@2x.webp,İstanbul,diş hekimleri,https://www.doktortakvimi.com/hediye-sahin/dis-hekimi/istanbul?utm_source=google&utm_medium=gmb&utm_campaign=122855&utm_content=website,,"Acıbadem Cad, Arma Çk No: 2/B D:1, 34734 İstanbul, Türkiye"
"Dt. Ezgi Boyra, Diş Hekimi",iletisim@docplanner.com; user@domain.com.; homepage-pro-banner@2x.webp,İstanbul,diş hekimleri,https://www.doktortakvimi.com/ezgi-boyra/dis-hekimi/istanbul?utm_source=google&utm_medium=gmb&utm_campaign=243591&utm_content=website,,"Acıbadem, Acıbadem mah. Akasya AVM Kent Etabı B1 Blok K:6 D:75, D:3, 34660 İstanbul, Türkiye"
"Uzm. Dt. Beytullah Gülsoy, Diş Hekimi",iletisim@docplanner.com; user@domain.com.; homepage-pro-banner@2x.webp,İstanbul,diş hekimleri,https://www.doktortakvimi.com/beytullah-gulsoy/dis-hekimi-ortodonti/istanbul?utm_source=google&utm_medium=gmb&utm_campaign=145322&utm_content=website,908503338344.0,"Fenerbahçe, 34726 Kadıköy/İstanbul, Türkiye"
Ahmet Efeoğlu Diş Hekimi,ahmetefeoglu@gmail.com,İstanbul,diş hekimleri,http://ahmetefeoglu.com.tr/,902163454132.0,"Korur Ap, Selamiçeşme, Bağdat Cad. 155/7, 34724 Kadıköy, Türkiye"
Lale Derlen Diş Hekimliği,info@lalederlen.com; bilgi@lalederlen.com,İstanbul,diş hekimleri,http://www.lalederlen.com/,902163309226.0,"Caferağa Mah. Sarraf Ali Sk. Timur Apt, No 21 D. 2, 34734 Kadıköy/İstanbul, Türkiye"
"Dt. Levent Emir Güneysu, Diş Hekimi",homepage-pro-banner@2x.webp,İstanbul,diş hekimleri,https://www.doktortakvimi.com/levent-emir-guneysu/dis-hekimi/istanbul?utm_source=google&utm_medium=gmb&utm_campaign=240319&utm_content=website,,"Acıbadem mah. Acıbadem Cd. No:195E, 34660 İstanbul, Türkiye"
"Dt. Vahid Noorzad, Diş Hekimi",homepage-pro-banner@2x.webp,İstanbul,diş hekimleri,https://www.doktortakvimi.com/vahid-noorzad/dis-hekimi/istanbul?utm_source=google&utm_medium=gmb&utm_campaign=262104&utm_content=website,,"Aşık Veysel Mah, Atatürk Blv. No:4/2, 34944 Fatih/İstanbul, Türkiye"
Osman Genç Diş Hekimi,,İstanbul,diş hekimleri,http://www.hekimce.com/hekim/6440,902124159130.0,"Gökalp, Profesör Muammer Aksoy Caddesi & 37. Sokak Güvenoğlu iş Merkezi No:41, 34020 Zeytinburnu/İstanbul, Türkiye"
Özel Aksa Ağız Ve Diş Sağlığı Polikliniği,,İstanbul,diş hekimleri,http://www.aksadis.com/,902125470827.0,"Çırpıcı, Rüstem Balkan Sk. 55/C, 34021 Zeytinburnu/İstanbul, Türkiye"
"Dt. Burak Arat, Diş Hekimi",homepage-pro-banner@2x.webp,İstanbul,diş hekimleri,https://www.doktortakvimi.com/burak-arat/dis-hekimi/istanbul?utm_source=google&utm_medium=gmb&utm_campaign=148044&utm_content=website,,"Yenidoğan, 58. Blv Cd No:133, 34020 Zeytinburnu/İstanbul, Türkiye"
Sibel Tezil,homepage-pro-banner@2x.webp,İstanbul,diş hekimleri,https://www.doktortakvimi.com/sibel-tezil/dis-hekimi/istanbul?utm_source=google&utm_medium=gmb&utm_campaign=152996&utm_content=website,,"Altunizade, Mahir İz Cd. No:47, 34662 Üsküdar/İstanbul, Türkiye"
Dr. Meriç Küçükcoşkun | Diş Eti Hastalıkları & Cerrahisi - Periodontoloji Uzmanı,dr@merickucukcoskun.com,İstanbul,diş hekimleri,https://www.merickucukcoskun.com/,905345980657.0,"Sümer, Prof. Dr. Turan Güneş Cd. No: 140, 34025 Zeytinburnu/İstanbul, Türkiye"
"Dt. Ahmet Ramazan Kara, Diş Hekimi",iletisim@docplanner.com; user@domain.com.; homepage-pro-banner@2x.webp,İstanbul,diş hekimleri,https://www.doktortakvimi.com/ahmet-ramazan-kara/dis-hekimi/istanbul?utm_source=google&utm_medium=gmb&utm_campaign=233112&utm_content=post_book_now,,"Doğu Mah, Lokman Hekim Cad No:23, 34890 Pendik/İstanbul, Türkiye"
"Dr. Dt. Özge Erdoğan Yılmaz, Diş Hekimi",homepage-pro-banner@2x.webp,İstanbul,diş hekimleri,https://www.doktortakvimi.com/ozge-erdogan-yilmaz/dis-hekimi-protetik-dis-tedavisi/istanbul?utm_source=google&utm_medium=gmb&utm_campaign=152838&utm_content=website,,"Acıbadem, Acıbadem mh. Çeçen sok. Akasya avm B1 yatay blok. Daire 75 Kat:6, 34660 İstanbul, Türkiye"
Diş Hekimi Ebru Erşan,mce68@hotmail.com,İstanbul,diş hekimleri,http://www.ebrukucukersan.com.tr/,902125720661.0,"Yeni Mah, Karat Ofis, General Kani Elitez Sk. No:1, 34142 Bakırköy/İstanbul, Türkiye"
Diş Hekimi Ebru Küçük Erşan,mce68@hotmail.com,İstanbul,diş hekimleri,http://www.ebrukucukersan.com.tr/,902125720661.0,"Yeni Mah, Karat Ofis, General Kani Elitez Sk. No:1, 34142 Bakırköy/İstanbul, Türkiye"
Deniz Işık - Diş Hekimi - Bakırköy İmplant - Bakırköy Diş Hekimi,info@isikdis.com.tr; dtdeniz@hotmail.com; mehmetfehimcelenk@hotmail.com; ezgiongoren@gmail.com,İstanbul,diş hekimleri,https://isikdis.com.tr/,905538535300.0,"Kartaltepe, Kartaltepe Mh. İncirli Cd, Yeşil Adalı Sk. No:1, 34145 Bakırköy/İstanbul, Türkiye"
"Dt. Serdar Genç, Diş Hekimi",iletisim@docplanner.com; homepage-pro-banner@2x.webp,İstanbul,diş hekimleri,https://www.doktortakvimi.com/serdar-genc-2/dis-hekimi/istanbul?utm_source=google&utm_medium=gmb&utm_campaign=146920&utm_content=website,,"Yenidoğan, 58. Blv Cd No:133, 34020 Zeytinburnu/İstanbul, Türkiye"
"Uzm. Dt. Ş.Merve Erbek Şişçi, Çocuk Diş Hekimliği (Pedodonti)",iletisim@docplanner.com; user@domain.com.; homepage-pro-banner@2x.webp,İstanbul,diş hekimleri,https://www.doktortakvimi.com/s-merve-erbek-sisci/cocuk-dis-hekimligi-pedodonti/istanbul?utm_source=google&utm_medium=gmb&utm_campaign=259575&utm_content=post_book_now,,"Acıbadem, Acıbadem Cd. No:45/29, 34718 Kadıköy/İstanbul, Türkiye"
Diş Hekimi Arev Bakırcı,buistsaglikuygulama@hs01.kep.tr; int.istanbul@baskent.edu.tr; bashekimlikist@baskent.edu.tr,İstanbul,diş hekimleri,https://istanbulbaskentuniversitesi.com/doktorlarimiz/dt-arev-bakirci,902166515153.0,"Osmanağa, Mimar Çıkmazı Sokak & Serasker Caddesi Aybek İş Hanı D:2, 34714 Kadıköy/İstanbul, Türkiye"
STOMADENTA Ağız Ve Diş Sağlığı Polikliniği,605a7baede844d278b89dc95ae0a9123@sentry-next.wixpress.com; dd0a55ccb8124b9c9d938e3acf41f8aa@sentry.wixpress.com; c183baa23371454f99f417f6616b724d@sentry.wixpress.com; 8c4075d5481d476e945486754f783364@sentry.io; 79baaa8e09c746d2b7401643b99792e0@sentry.wixpress.com; info@stomadenta.com.tr; 8eb368c655b84e029ed79ad7a5c1718e@sentry.wixpress.com; hakan@bilhan.info,İstanbul,diş hekimleri,http://www.stomadenta.com.tr/,902166802321.0,"Kavacık, Fatih Sultan Mehmet Cd. No:10 Kat:4, 34810 Beykoz/İstanbul, Türkiye"
Uzm. Dt. Tayfun Tolgay Çelik Ağız Diş Ve Çene Cerrahisi Uzmanı implant tedavisi İstanbul zirkonyum,info@viyoladis.com,İstanbul,diş hekimleri,http://viyoladis.com/,905525732117.0,"Kayışdağı, Akyazı Cd no: 3/A, 34755 Ataşehir/İstanbul, Türkiye"
"Dt. Şah Cihan Taşgın, Diş Hekimi",homepage-pro-banner@2x.webp,İstanbul,diş hekimleri,https://www.doktortakvimi.com/sah-cihan-tasgin/dis-hekimi/istanbul?utm_source=google&utm_medium=gmb&utm_campaign=246343&utm_content=website,,"Gökalp, Tamer İş Hanı, 58. Blv Cd No:2, 34020 Zeytinburnu/İstanbul, Türkiye"
Çocuk Diş Hekimi Ömer Tarık Özdemir,,İstanbul,diş hekimleri,https://omertarikozdemir.com/,905538885444.0,"Osmaniye, Ümraniye Sk. No:2/B, 34146 Bakırköy/İstanbul, Türkiye"
"Dt. Can Berk Özer, Diş Hekimi",iletisim@docplanner.com; user@domain.com.; homepage-pro-banner@2x.webp,İstanbul,diş hekimleri,https://www.doktortakvimi.com/can-berk-ozer/dis-hekimi/istanbul?utm_source=google&utm_medium=gmb&utm_campaign=150106&utm_content=website,908503338344.0,"Şehremini, Büyük Saray Meydanı Cd. No:62/B, 34104 Fatih/İstanbul, Türkiye"
Diş Ve Diş Özel Ağız Ve Diş Sağlığı Polikliniği,randevu@disvedis.com; info@disvedis.com.tr,İstanbul,diş hekimleri,http://www.disvedis.com/,902126242473.0,"Gültepe Mah Reyhan Caddesi No:30/A Küçükçekmece/İstanbul Reyhan Caddesi Carrefour Karşısı, 34295 Küçükçekmece/İstanbul, Türkiye"
Büyükçekmece ağız ve diş sağlığı merkezi Selimpaşa Diş Tedavi Ve Protez Merkezi,istanbuladsm7@saglik.gov.tr; shgm.saglikturizmi@saglik.gov.tr; mhrsyardim@saglik.gov.tr; alo191@saglik.gov.tr; sb@hs01.kep.tr,İstanbul,diş hekimleri,https://buyukcekmeceadsm.saglik.gov.tr/,902127318255.0,"Selimpaşa, 204. Cd., 34570 Silivri/İstanbul, Türkiye"
Reşitpaşa Diş,yarenkeskin@resitpasadis.com; fatiharat@gmail.com,İstanbul,diş hekimleri,http://www.resitpasadis.com/,905064502295.0,"Reşitpaşa, Tuncay Artun Cd. No:27, 34467 Sarıyer/İstanbul, Türkiye"
AcunalDent Ağız ve Diş Sağlığı Polikliniği,info@acunaldent.com.com; info@acunaldent.com,İstanbul,diş hekimleri,https://acunaldent.com/,902128923233.0,"Maslak Mahallesi, Taşyoncası Sokak (Maslak 1453 Sitesi, C14 Blok), No1S, İç Kapı No:Z6, 34398 Sarıyer/İstanbul, Türkiye"
"Uzm. Dt. Tuğçe Yuca Öztürk, Diş Hekimi",iletisim@docplanner.com; homepage-pro-banner@2x.webp,İstanbul,diş hekimleri,https://www.doktortakvimi.com/tugce-yuca-ozturk/dis-hekimi-endodonti/istanbul?utm_source=google&utm_medium=gmb&utm_campaign=239526&utm_content=website,,"Maslak Mahallesi Maslak Meydan Sokak No:1/1 Beybi Giz Plaza, 34485 Sarıyer/İstanbul, Türkiye"
Özel Esenyurt Magma Ağız ve Diş Sağlığı Polikliniği,info@magmadis.com,İstanbul,diş hekimleri,https://www.magmadis.com/,905421051500.0,"Atatürk, Adnan Kahveci Blv. No:39 D:3A, 34522 Esenyurt/İstanbul, Türkiye"
Özel Klasdent Ağız ve Diş Sağlığı Polikliniği,,İstanbul,diş hekimleri,http://www.klasdent.com/,902126894553.0,"Osmangazi, 61, Mareşal Fevzi Çakmak Cd., 34522 Esenyurt/İstanbul, Türkiye"
Diş hekimi Sibel Şen ve Diş hekimi Sinan Şen,,İstanbul,diş hekimleri,https://senestetik.com/,902126608818.0,"Kartaltepe mahallesi, Alpay İzer Sk, Yuvam Apt N:11 D:2, 34145 Bakırköy, Türkiye"
"Uzm. Dt. Berat Metin Adak, Diş Hekimi",homepage-pro-banner@2x.webp,İstanbul,diş hekimleri,https://www.doktortakvimi.com/berat-metin-adak/dis-hekimi/istanbul?utm_source=google&utm_medium=gmb&utm_campaign=268362&utm_content=website,,"19 Mayıs Mah, D100 No:1087, 34500 Zeytinburnu/İstanbul, Türkiye"
Diş Hekimi Halit Büyüköğüt,homepage-pro-banner@2x.webp,İstanbul,diş hekimleri,https://www.doktortakvimi.com/halit-buyukogut/dis-hekimi/istanbul,902125754551.0,"Abdurrahman Nafiz Gürman, Şair Ahmet Kutsi Tecer Cd. No:14, 34173 Güngören/İstanbul, Türkiye"
İstanbul İmplant Klinik Diş Hekimi Erol Atalay,605a7baede844d278b89dc95ae0a9123@sentry-next.wixpress.com,İstanbul,diş hekimleri,http://www.istanbulimplantklinik.com/,902125680104.0,"Şehremini, Kızılelma Cd. Babaanne Apt D:2/1 D:2, 34104 Fatih/İstanbul, Türkiye"
Uzm. Dr. Dt. Serkan Güleç (Çocuk Diş Doktoru),,İstanbul,diş hekimleri,http://www.serkangulec.com.tr/,902124144209.0,"Zeytinlik, Halit Ziya Uşaklıgil Cd., 34140 Bakırköy/İstanbul, Türkiye"
Diş hekimi Sinan Şen,,İstanbul,diş hekimleri,http://senestetik.com/,905323545920.0,"Kartaltepe, Yuvam, Alpay İzer Sk No:11 apt. D.2, 34144 Bakırköy/İstanbul, Türkiye"
Diş Hekimi Yusuf Sert,info@yusufsert.com.tr,İstanbul,diş hekimleri,https://www.yusufsert.com.tr/,902125770000.0,"İslambey, Tülbentçi Muhittin Sk. NO:14 DAİRE:1, 34040 Eyüpsultan/İstanbul, Türkiye"
Seçkin Diş Ağız ve Diş Sağlığı Polikliniği,info@seckindis.com,İstanbul,diş hekimleri,http://seckindis.com/,902126255555.0,"Merkez Mah. Reşitpaşa Cad, Yeniyol Sk. No:2, 34310 Avcılar/İstanbul, Türkiye"
Diş Hekimi Alperen Aydın,info@dtalperenaydin.com,İstanbul,diş hekimleri,http://dtalperenaydin.com/,905432121032.0,"Kartaltepe Mahallesi Süvari caddesi No:10 D1blok İç kapı no:30 Sefaköy, 34295 Küçükçekmece/İstanbul, Türkiye"
Kadraj Ağız ve Diş Sağlığı Polikliniği,info@kadrajdispoliklinigi.com,İstanbul,diş hekimleri,https://kadrajdispoliklinigi.com/,905334096982.0,"Ferahevler, Adnan Kahveci Cd. No: 4A, 34457 Sarıyer/İstanbul, Türkiye"
Ultradiş Ağız ve Diş Sağlığı Polikliniği,info@ultra-dis.com,İstanbul,diş hekimleri,http://ultra-dis.com/,902165965353.0,"Çamçeşme, Marmara Cd. No:58, 34899 Pendik/İstanbul, Türkiye"
Sarıyer Beyaz İnci Ağız ve Diş Sağlığı Polikliniği,sariyerbeyazinci@gmail.com; sariyer.clinic@gmail.com,İstanbul,diş hekimleri,https://sariyerbeyazinci.com/,902122186555.0,"Merkez Mahallesi, Şehit Mithat Yılmaz Cad. Kayadibi Sok. 2-3, 34450 Sarıyer/İstanbul, Türkiye"
Oval Diş Kliniği,mail@ovaldis.com; ovaldisklinigi@gmail.com,İstanbul,diş hekimleri,https://www.ovaldis.com/,905528158245.0,"Bahçelievler Mahallesi Adnan Menderes Bulvarı Majesty Plaza, kat 1 No 37, 34500 Pendik/İstanbul, Türkiye"
Special ALPİNE DENTAL Hospital - E5 Kaynarca,,İstanbul,diş hekimleri,https://www.alpidis.com/,902162110028.0,"Fevzi Çakmak, Akdeniz Cd. No: 46, 34899 Pendik/İstanbul, Türkiye"
ANADOLU DİŞ - ANADOLU AĞIZ VE DİŞ SAĞLIĞI POLİKLİNİĞİ - PENDİK DİŞ POLİKLİNİĞİ,info@anadoludis.com.tr,İstanbul,diş hekimleri,https://www.anadoludis.com.tr/,902163907172.0,"Kaynarca, No:1, D-100 Yanyolu, 34890 Pendik/İstanbul, Türkiye"
07 Den 70 E Ortodonti & Implantoloji,,İstanbul,diş hekimleri,https://07-70dis.com/,902163900770.0,"Batı, Hatboyu Cd. No:32/C, 34890 Pendik/İstanbul, Türkiye"
Diş Hekimi Burcu Barı,,İstanbul,diş hekimleri,http://www.burcubari.com/,902125810436.0,"Merkez, Fahri Korutürk Cd. No28 Kat1, 34050 Eyüpsultan/İstanbul, Türkiye"
B&B Ağız ve Diş Sağlığı Polikliniği,admin@bbdentalclinics.com,İstanbul,diş hekimleri,http://www.bbdentalclinics.com/,905451553642.0,"Bahçelievler, Nazim Hikmet Cd 24c, 34893 Pendik/İstanbul, Türkiye"
Dentapolitan - Pendik Ağız ve Diş Sağlığı Hastanesi,info@dentapolitan.com,İstanbul,diş hekimleri,https://www.dentapolitan.com/,905494434160.0,"Bahçelievler, Mostar Blv. No:27, 34893 Pendik/İstanbul, Türkiye"
"Dt. Yücel Levent, Diş Hekimi",homepage-pro-banner@2x.webp,İstanbul,diş hekimleri,https://www.doktortakvimi.com/yucel-levent/dis-hekimi/istanbul?utm_source=google&utm_medium=gmb&utm_campaign=152588&utm_content=website,,"Yeşiltepe, Turgut Özal Millet Cd Adasaray Apt No:53/1, 34096 Zeytinburnu/İstanbul, Türkiye"
